text,lable
sexocom japonesa co tp6oxyvcwu freeassvideo pornoz video x89 co pep59yvnxf,1
rt lbardugo real shadow amp bone six crow come netflix grishavers come life,0
lizasoberano mother advic hopi pleas concern peopl x89 co nkxhqan1to,1
katystol get southern team went ole miss parti championship,1
senatorcantwel pattymurray yet anoth exampl predatori hospit r interest provid,1
rt characoolin neva love slut bitch,0
new victim card drama porkistan 45 blood amp slut mouth fart go hell pak porkistan land human bloo,0
x89 final peac concert heaven probabl milli rock singi x89 co diz09gkynm,1
japanes lesbian massag gape young granni fist manga porno blowjob facial cumshot x89 co 6li4jdjwpv,1
riahleonlandon nope idc say amp text back slut,1
briannawu look big mac two week ago amp delici lump stomach 2 day point,0
kam60584130 deiliciousss naman baba lessen worth wh x89,1
ya x89 beauti co unc4ktf7fu,1
rt loseriex funni girl slut shame tweet someon send 100 reason,0
x89 hous never bitch barbi x89 slut better x89 co z8mbujxrjp,0
nake pictur wwe diva melina free porn pictur girl free full porno video adult road helmet new porn pic,0
rt oldabzuka62 dait rt fuck amp dm blowjob retweet amp like see full video cont,1
everi think girl saw tmz 15 year ago show tramp stamp girl gone wild,0
fo r php fa amp uc k a5nt amp p 5 434375 amp v 17341189 gril mariana cordoba cumshot mouth pass x89 co gc3e75uzbk,1
hello one newer recruit tpd red commenc train feb amp replac pd ava,0
matur matur includ act sassi bagay x89 co 0x4cvvamak,0
runaw6i thing rememb call slut watch x89 co fwrdoppeni,0
sheebpl sell california instead,1
slcmof filmgob bro tri use call batgirl slut joke way prove toxic lmfaooo guy moron,1
zelajesus killa hakan judg mee,0
sexi zeland video girl explicit guid co 1xkq4vamnp,1
ever jalen sassi talk tyreek amp everybodi callin trash gettin toast x89 co lqtjwfuo4n,1
show word action otherwis,0
slut kittiesauc flash boob webcam 6cambiz n co acnu8cgu7c stori mather x89 co kkacoilnr0,0
rt dreamyphil im slut morph amp cml,1
muhment gamerg mean game right,1
bug eye retart bartend slut hot dog bun real name sandi lie bitch geor,0
rt momcentrl wanna believ bd amp famili regret know ava honest emot connect,1
peopl excus famili could liter peopl w x89 co pyc1qbjybj,1
thief beg creampi instead cop xxx hd nsfw orgasm wet horni pussi sex porn video xxx rt,1
subway x89 meatbal stuff call slut success,0
rt naknightstrack new school record girl long jump relay triniti tapper rachel brimmer amp emma martin break school record set,1
zero everlast gaze ava ador smash pumpkin guitar riff amp solo nofilt noedit noeffect,0
isabelgarza7491 hoe slut hor uhhhhhhhh fuckin,0
exact think filthi slut whose skill bed far outshin pilot skill,1
merickson05 happi birthday countri much keep live sassi 10kferguson co el7 x89,0
mom cousin fb constant post realli stupid shit call bitch tonight amp mom yell,1
say bitch that legit take bad word bitch affect anyon call,0
chinkomami let x89 relationship friend co bthurfplvx,1
g x89 head behind timb chop chees,1
success girli shop trip far ava amp bath hair wash rare occurr,0
dumb fuck hospit,0
happi 7th birthday twin granddaught grandma littl ladi ms ava amp lea moor guess parti weekend,1
djposa mixtap n n lilyachti nuthin x89 2 prove chop co z38tcmlrtm n ni realli x89 prove x89 x95 x8f x8d x8d 1017chopz ht x89,1
swear cant fuck could fuck girl make nut slut kill,0
cash celeb amateur orgasm school mutual masturb shower creami orgasm lesbia x89 co vqbprln0hf,1
isi slut widow 3 time doubt like follow dick,1
briannawu minim anyon pain amp suffer think go facebook hospit zuckerb,0
white skill n co 2zdgqn9mkf nerdi nikki hardcor clock interraci summer petit amateur x89 co es4w5ekpq,0
friend didnt toxic abus everyon ar x89 co dv723ouviq,0
thehil ava navarro woman amp appreci fill stereotyp women way,1
need nasti slut bitch,0
chidinma xo hilari women profil pikk like 24 7 skill cau,1
0x11bdb85 briannawu realgacinski father work walmart food stamp fraudster,1
wake ava favorit part day littl morn stretch yawn amp gurgl grumpi morn face soooooo cute,0
maryeb2boyl reprichardn repstephenlynch briannawu serious concern trump amp associ c,1
kevingzepeda dog boy anymor straight make sure tell cuban girl life live slut,0
home alon work damp raini quiet send messag sai x89 co 8m2qxwtkub,0
thotwin play sweet psycho ava max listen amp vote 4,0
wha blind woman forehead chin eyelid smile like x89 co tirpd8wucr,1
rt cullenroisin honour chat andi eakin doubl standard slut shame amp pay pig ever go,0
ofhysteria x9d x90 x9d x90 x9d x90 x9d x90 x9d x90 x9d x90 x9d x90 x9d x90 x8f n n x8b x87 x87 x83 x87 x8fs x87 x83 x87 x8f x87 x83 x8b x8f n n year old n still sassi n cheerlead n insid n x89,1
haha call post pictur donut voodoo,1
droid slut skanki call look kinda shock,1
ayami neesan random sassi horni x89 wear cloth talk x89 x89,0
avail uber eat ava kitchen amp bar,1
mangplushi philstok sassi soda answerhopi probabl caus popular day x89 co nzktl2s6em,1
forgot costum slut x8f x89 x8d x89 x95 x8f,1
miss old slut go fun bitch,0
girl come new dm masturb live bi horni boob tit pussi porn nsfw cumslut blowjob sex slut,1
check ad closet poshmark last chanc ava amp viv sparkl shirt,0
repost iamslutlord use repostregramapp sell slut might ya girlfriend,1
rt jovanmhiii mfer say social anxieti purpl hair steven univers shirt like girl make anxious,1
ava amp olivia 1 year nashvill twin photograph smyrna tn photograph,0
grey603 play switch nintendo onlin slut nes game know everyon bitch,1
rt itssafinaa know funni kim would never life style without kany,1
hi real slut come suck dick get cum gotta ask girl permiss,1
colleg parti cumshot surpris black matur ride dildo doubl public sweet x89 co cdbthmrsx7,0
hardcor fuck eboni video indian fuck lesbian lick public natur huge x89 co bvy8e23tqm,1
ava steve king member congress 2019 say wrong white supremaci amp white n,0
mmahnanthoni kane anon ba may raka cc pero social media person di makaingon coward slut bitch,0
janki p bitch chop screw music fr,1
terribl trend sassi x89 co yqpungwhpj,0
rees witherspoon lookalik daughter ava amp mom pose vogu access pleas rt,0
brand new ava amp viv plussiz 4x brand new tag jacket see next tweet purchas link ebay,1
rt alexadasiav never shirt nude cumwhor venmo sugardaddi sugarbabi horni ass youngteen schoolgirl cumslut tit,1
folk n nt co dw7eevoibu,0
gleawlic wozziewaser dude x89 gamerg x89 bullshit harass post x89 co 5rgfncpomi,1
jorti ava julian amp bruca actual interest peopl come,0
frank told kevin ava amp kevin like whatev gh,0
srhenry12 stephen groner flotus whitehous say b c beauti critic th,1
rt irishchart week offici irish singl chart see seven song reach new peak incl markronson amp mileycyrus noth break,0
look profil see price cheap ass horni slut nude bitch fat fuckm boob boob tit tit,1
rt gxrneym far mani boy call girl slag slut get reject slag slut whore whatev slur p,0
rt quadrant4chang ava blame lie everi adult present stood amp let happen lie white coach amp predominan,0
sheeeeeit ltc went like anuddah shekel,1
gothdlck ginger bitch manag drag slur yeeeeeeeessssssss throat could bare sp,0
wait everi bitch co bqvczyjjtq,0
sarahspain mgolicjr57 mikefreemannfl gase game osweil amp cutler magic right,0
nake slut vid blow porn tube carolina pussi homamd pic forum hot girl shower hd anorexia xxx anal font video,1
briannawu williamleg one reason cant stand amp refer fuckerberg,0
sarahspain actual feel pretti fuck good right,1
theyr give epcot everyth deserv,1
kara lynn0 x89 fuckin sassi tryna bitch co tzj4gvz0zq,0
babi jake33 stop bitch peopl get gainz fall behind littl slut,1
confess rate erotica co qm2hzzg28i realli enjoy amazon co qynnpyjxno,0
bore play pussi add kik dirtybabe4 follow addmeonsnap bj slut f4f naughtygirl ass,0
older probabl togeth pffftttt littl littl slut,1
flatmat gave back copi beauti ruin amp thought read miracl last chapter bef,0
buy dropbox 10 instead paypal hurri hehe kinkygirl slut slutti fuckm yesdaddi,1
faiza tg spell error nyou letter whole tweet urin,0
degrad love shit call slut whore bitch eat pull hair call cockslut w,0
believ kimber almost 40 kardashian lip sync song essenti slut shame girl half age whi,1
littl heart x89 ohhhhh sooooo sassi x89 x95 x8f co tpgdhrlhl9,1
rt thetweetofgod fuck dare put,0
exampl bigger fulli dress,0
littl sassi sauci blake bestfriend sinc da x89 co 82is0mrivv,1
bitch x89 co zbtdlrweji,1
drink mud take ya girlfriend turn ha night time slut,0
rt yvesdol w wait emma said next video gonna long one amp ethan tweet ethma video,0
feel like sometim correct gender differ wrong direct exampl stop slut sh,1
cum buy nude dm detail nude porn pornhub cam camsess chaturb snapchatpremium cum,0
yes nice amp deserv exact point make victim miso,1
rt video like cumtribut cockslut slut follow wanktribut girl cashslut anal dick porn feet,0
sometim im club feel like bitch becom hoe slut drop place kiss friend,1
rt w terrenc 7 year old girl shot amp kill walmart park lot blm shaunk thought white man peopl,1
gvldenmilli x89 stupid wear cloth x89 shit bitch dress amp still slut,0
rt lilahot69 ride cock horni babi rt regist write note verifi email send,1
jenni constant disgust x89 typic x89 x89 sing x89 x9d x89 liter x89 co dxkglob9wo,1
hard beauti bond someon built strong foundat friendship amp loyalti,0
god video julian x89 x89 movi heyyyi whoajhjdjdjdj x89 x9d bitch x89 video movi slut,1
stan ariana girl class keep call slut googl pictur insult,0
know guy insta twitter follow 100s random girl slut mate,1
teen pussi adult front lesbian porno girl pretti co 4wqr8qilco,1
find classi sassi x81 x8f x89 x8d x89 x95 x8f,1
rt bykevinclark bruce arian hire buc flew tampa show,1
pink kany biggest piec earth quot,0
blackwednesdi robertsemma realli miss madison montgomeri bunch edit sassi x89,1
klhpyro im slut kp,0
ijm frizzi sonni nlm alway need call women bitch slut,1
sometim wish could gangbang forev label slut shit,1
use pictur ava wow ugli bitch phone,1
lick titti like cigarett bad gyal bitch femm fatal b,1
person love everi ounc,0
impuls haircut inch chop bitch lmfaooo,1
rt brysontlii child grow think best friend amp come anyth fail,0
need dick big fuck want fuck pleas contact dm horni boob tit pussi porn,1
bitch knock sens person sometim,1
anyon halloween peopl scare film peopl get chop,1
slut korean flash pussi webcam find6xyz n co b8s3c6urm5 twopenissex xxxmilfsolo wife x89 co szwp0kq606,0
mckennagrac vanillaic imagin futur littl talent sassi,0
guy fuck dulc chop bleach myse x89 co ts9aatx15c,1
rt nhfthr fermatslibrari 3 x 12 inch pizza mean tripl choic topic amp pizza 1 x 18 inch pizza gotcha,0
missionari creampi blowjob x89 co d5owgqwbch,1
congrat osceolamagnet student joaquin malav ava cook caitlin swanson go state tampa thu,1
rt houston vicious watch cnn weather man hide dew haarp plain sight californiawildfir campfir wool,1
bitch brutal tortur minor servant starv major ammara x89 co okqkbsrhlc,1
ahahaha x89 hilari bitch feminazi hug hope x89 co fo6sebeb5u,1
total report lead ava lee anti corrupt campaign global wit comment despit fact,1
aj fairley breakfast date thing readi lunch,1
still friend eachoth choosingcv x89 x89 gutter co rsckc2tluy,0
cllpse khaleeji generat n ndemon succubus n nangel witch n nwaifu devil venus n nsin x89,0
xxx student video latina beurett video pussi laroch video fill video 18 x89 co jwktbe7nsa,0
slut shame actor delusion ship appar sail amp project one bechara new norm day,0
sunshin 1601 milehighmafia19 sluttin grey sweat direct respons bc land one,1
rt abbycohenwl daughter tran woman comprehens list peopl institut harm identifi,1
mistress luxx think x89 notic broke bitch block bitch x89 anyth promot x89,1
sassi smart x89 ruin happi father right go mind x89 x9d,0
ima chop throw listen coupl song enjoy handsom,1
minor think anyth thing guarante that death x89 co o8a9r5xdrb,0
rt jacykhan mmmmmouaahhh iamsrk men live one amp precious hamara farishta happin,0
palefacevixen tweet togeth caus n nand know,1
ankitabitchi anusharmaloveu sexynavel hottyonb nangu69 sluttyx1 sexobeast pussycat oo naughti,0
min sassi jimin pleas needi bitch ohhhh thank x89 co 8rmdoldz9z,0
rt jamescharl watch art video amp guy liter look camera goe alway lot opinion te,0
porn asian women fuck highheel master nake twerk co vffpvnukvq,0
gotta retweet ya see beauti,1
free japanes collin gloria leonard websex women search chile older duncan citi x89 co gsaeuulyot,0
sarahspain awesom way champion common sens right refresh,1
shame girl nakey insta twitter your still illeg hunti,0
sara ava total fuck time bureau headquart,1
everyon x89 quot harri tweet x89 happi x89 x89 call x89 littl x89 co vcvd7m4erj,1
campaign trump suggest cruz amp father assassin x89 co 5igqb74qmr,1
asian hairi fuck hard n co kmylxwmnkn malecumclip hardcor quickblowjob hair x89 co o7oalalsxv,1
fcukjjgk true advertis slut slut,0
tye sassi grandma x89 unse,0
queer novelist grindr q amp comedi bbc slut look fill ask theme,1
babyboysaki bts jooni 94 talk soooo annoy bitch care x89 co vnximdn8wb,0
jace amp got ava love today love trucdoann come town come ugh miss u,0
jeff liebermann sarahspain toddbrommelkamp spainandfitz jasonfitz pleas woman scintil convers impress law,1
rt angbf14 repeat girl cast communiti countri deserv rape threat slut shame matter whatev b,1
rt clemsonfb true freshmen em nationalchampionship allin,1
happen india women kill chop ask x89 co lm7jjsq8fr,0
seattl polic know never kind prostitut whore kind slut amp told th,0
rt nickelodeon drake amp josh air 15 year ago today 15 year ago today emphasi,0
sarahspain brendatracy24 dang sarah spain watch time high question amp around horn haha,1
sister left tonight live campus cat feel type way decid take laptop,1
roco141 horni x8d xa0 horni snapchat x8d ncum femal n horni horni x89,1
peterssuz krassenstein donni interrog wrong usual chop u x89,1
meme slut sofi frog twitter girl autism,0
dana rene lookin girl fuck hummer truck appl bottom jean big ol slut pleas tel,0
ava lauren barbi dana dearmond humili interraci creampi jog stranger urin cam facesit tittyfuck,0
bitch bye23 anchorsavi mean less crimin druggi slut anchorsavi,1
briannawu one give fli fuck r kelli anymor,1
kill even marlena took slut side comfort bitch wreck daught,1
leh said bell delphin cutest slut ever amp fall patreon ac trap bfwndkepltgsj,1
offici irish singl chart avamax fend mark ronson amp miley cyrus claim fourth week number 1,1
rt elizaporn deserv ass retweet amp like see full video contact,0
incest taboo teen slut porn alex coal slut stepsist 03 13 next part amp full,1
rt nxirvanna brazilian girl world carnav one holiday year girl dress like total slut girl,1
ebss r x89 halloween dress total girl anyth x89 x9d x89,1
need older horni young cock boob tit bigcock bigwhitecock dmme cocktribut nude sexi x89 co iebmu0nl4v,0
bitch realli perform badboy peekaboo aka slut anthem right front salad huh,1
x89 x89 littl thing life x89 x9d,0
sell custom nude amp video dm price sugarcaddi sugarmommi horni slut cumslut young gir,1
thotwin rock sweet psycho ava max play next hot 107 9 listen amp vote 4,0
jizzellerosal liter happen co z7ps7pajzb,0
rt iqracatoo still rememb ur first scene akshara amp end alvida scene akshara chali gai per hamesha ke liya hmare dilo bas,0
filip g loco rtsportnew find girl slut,0
slut drop nonbinari namjoon tran yoonji,1
say insid post bru x89 co pmlwrbk7oe,1
welcom back jasonfitz show jason amp sarahspain continu weed coach move,0
ava america home free amp brave wonder kneel almost seem pardon add,0
year tri achiev hotter slut last,1
proper slag think x89 funni someon x89 tryna n nlike x89 co yb0hvsvz7n,0
fredo bang hardbodi chop today,0
even updat appar bodi think 40min nap good substitut good night sleep fuck wide awak,1
bugboyaf uhhh ms anya amp mother minor comic charact count toni stark maria hi,0
slut hawaiian bread amp spinach dip,0
hot love like rt wet singl girl amateur boob cumtribut date feet fuck hot,1
slut whore youtub video get fuck pantyhos women hentai naruto co ttqronjgbq,0
rt heavenbrat realli slut love like id realli risk love cuz 1 im dumb bitch bullshit 2 much,1
rt senblumenth indict russian lawyer infam trump tower meet portend peril trump jr amp kushner much come h,0
x89 actual import tackl cultur decreas gender end inher misogyni slut sham x89 co dgkqt63zwh,1
rt tani vander photo sex porideo video porno xxx tabatha cash xxx video vie mom sex porno izl video xxx fuck pictur film po,0
alway slut bath amp bodi work,1
thepenit slut shame life fact fact thank cut expens nyc livin,0
play pussi rn anyon wanna join kik dirtybabe4 tit hotgirl asshol finsub dirti fuckm,1
roxiibayb mattrussell85 clear slut shame say show bodi bad influenc young girl lol,1
rt leahg thompson nyquil pill could drive car 1 hour take power babi aspirin absolut fuck suck nyq,0
avakoxxx look lush fuck red ava babe xx,1
rt minti da know stereotyp tran girl give compliment without deflect u ing fine b,1
captainchilli ava amp sara kiss 20gayteen mani 20biteen,1
acct 50 shame other think slut person amp 50 slut person yes,0
killawatt nvm dont answer slut,0
casewinter13 ahemnotquit mrdashikivii thelewscannon lo thuggan jessicavalenti benshapiro king yea amp,0
araivanbuuren mooniunatik sfqomhz call teenag stranger bitch sassi x89 co daatkzqfnn,1
black man make love cute pussi gt gt sign note verifi email send msg girl,0
hotel month loopi enjoy comfi servic,1
awe thank ashhh wuv sassi co awherlfmth,1
uber need x89 silent driver x89 x9d option caus would abus shit,1
told ava soooooo mani time answer text time phone stupid bitch,0
rt graci wilson tweet extrem disrespect wait day stop slut shame women amp determin worth base,0
rt tiapogai51 want see big tit show everyth regist note verifi email send msg girl,1
lyawatha time walk eagl cannot co 4igbtdee6,1
realli wish homeboy slut bitch dont like,0
rt rossfield1224 chico local former multi champion boxer ava knight hope get back ring next month check avaknig,0
keepingncr lawcrimenew peopl think fals accus ridicul democra x89,0
x89 bitch come relationship crazi slut x89 hop dick x89 co ecjac8djwp,0
swear femal weird sit class happen call girl slut,1
girl talk mani guy slut dude talk mani girl normal get prais,1
everi forsaken planet co gnygjteoe6,0
sex turn co 0vnyb3wq01 teen virgin whore karachi x89 co net8fby9b,1
rt bologuni60 retweet amp follow wanna see full video contact,1
rt mynam eddi im slut great presidenti campaign coverag,1
ok super wednesday sassi twitch sister saturday hello gamer c x89 co sihrnsgyyg,1
teenag anal dirti talk young black pornstar bangladeshi fuke girl teen porno parti girl love anal free gainsbou,1
never understand girl smear lip legitim unattract especi x89 co d9r9gquevz,0
porn analsex flexibl pussi slut cumshot granni gangbang mother australia co yrbkmsjxh9,1
theperezhilton honest behind close door call shame c x89 co tlu1cgdrfk,1
rt abalisah girl outsid club 4am tri figur nissan honda focus look like,0
sex date citi nake girl wait right adult date cont,1
leav good classi girl slut like druggi drop weed pick grass,1
come guy buy dropbox enjoy paypal pm kinkygirl slut slutti fuckm yesdaddi daddi,0
check kinki xxxvideo ddlg slut schoolgirl nude wet taboo fuck publicfuck freak,1
rt tiapogai51 rape boyfriend gt sign note verifi email send msg girl slut,0
theshawnyboy realli x89 either shame x89 disgust,0
girl caught masturb nake women hardcor hentai video girlfriend cheat first ti x89 co vgv19ii4q,1
charmingcey bitch count start x90 prepar death x89 dont mess x89,0
cumshot compil amateur blowjob omegl pussi school st x89 co bwrusqn2cb,0
artbarrena johnzag briannawu nope rather stay fuck,1
slut shame fuck kill,1
rt lawrenc everi word lindsey graham say scare republican challeng 2020 elect campaign everi word,1
ava 3d doll dress amp danc care game girl via youtub,0
hredrid flash peni colleg parti sexual assault littl see peni ladi toler x89,0
rt naturalemystix black men fuck beauti,0
dopamin slut smile respons smile sure youll fuck,0
caught glanc mom hous femm fatal bitch slut lick leg,0
even dom never call someon slut whore bitch without consent sub wanna degrad tbh,1
deepthroat cumshot jerkoff instruct teenporn eboni lesbian pussi naruto hentai young ebo x89 co klhr9fuvto,1
ava actual stay band camp,0
commit slut like suck dick n nyou relationship strategi x89 co pigph7jum,0
nicknam call princess babi babygirl babe love angel kitti pup bunni slut whore tbh degrad shit,1
rt g kohl 10 day free ship check ava amp viv women 3 4 sleev pullov sweater black gold size 2x 20w 22w,1
wow play tonight busi wait bitch alreadi admit singl x89 co rqxft2uhr1,1
dirti ass rat ass hoe ass slut ass crusti ass dusti ass dumpster juic ass bottom barrel trash bag ass bitch,1
realli realli refer certain type food would duck x89 co hemzxj7f5u,1
follow killuh smokez47 ig killuhsmokez47 420 4 killuhsmokez47 killasmoez 4 8 7 dolosmokez33 bluevv soundclou,1
nigga x89 sassi westbrook co skzqrnabgb,0
sassi cours catch x89 sleep smile giggl cut x89 co ededllwldx,0
robbieann4 therevboblevi kayajon rodstryk rosi realdonaldtrump everi disagre call x89 co scyzwsgzlr,0
bdsm hardcor action rope sex horni marijuana nsfw nude nude nudetrad sang,1
guy free advic hear guy call girl ka sefeb sechacha slut motho wa bo teng ha,1
somalypussi x89 circl bitch,0
taylor releas song call break girlfriend bore would liter slut shame cancel,1
shame noth meanwhil encourag peopl x89 co ulck0ilkwl,0
rt gurubluxviii retweet boost amp tweet ibjiyongi chefresha eveew thewayoftheid tylerperri kevinhart4r katearonoff demetriao,0
slut adderal like yes pls make fold 8 basket cloth paint finger amp toe nail give dog,1
messag buy nude vid whatev want babygirl sugardaddytwitt sugarbabi paypiggi,1
chines blowjob cumshot n co 8bw9rifsax underag illeg cumshot rajasthani x89 co p9aacqvajk,0
asukahomo ava wa phone froze like like 5 minut click fuck tweet,0
rt mattybrap hey bfamili check new singl 808s amp motiv ft ava davi watch,0
happi birthday pretti thank hang ava amp alway offer help hope fantast day,1
ava gardner david niven amp stewart granger littl hut vintag movi full life,0
bite ubitch jontlofgren right precis amount sex requir justif,0
alway light nail today x89 kinda x89 sassi x89 x9d lmao,0
mention probabl chop actual footag,1
ohthatsmayo friend call nigga wrong stop bitch x89 swear x89 x89,0
sudden surround comment say peopl main men stand seem,0
x8f regular sleep nasti whore bitch co amgklmzjrf,0
rt 222gr00vyjaz222 thesteelyhan queenawaken sacredrebeiiion live cowgirl slut aesthet tbh especi sinc libra ru,0
rt jcball briannawu minim anyon pain amp suffer think go facebook hospit zuckerberg,0
nake slut vid blow porn tube carolina pussi homamd pic forum hot girl shower hd anorexia xxx anal video hot,1
x89 crazi x89 dick,1
domlikesalpaca messag girl boyfriend tell cheater x89 believ show x89,1
squirt uncontrol tight cage good sissi slut marywillow slut sissi femboy tgirl,1
aghanaiangirl slut shame done azonto land,0
ad video youtub playlist make offici danc video vice amp jason derulo feat ava max,1
lie saturday scroll twitter n nso seen leather x89 co 0tafe1ihqf,0
lil django3030 said girl sex multipl peopl use amp one want,0
sarahspain gofundm campaign set replac woman burn car,1
itsjr sweet psycho ava pop star g dle madison beer amp jaira burn,0
anastasiaa g omg call whore bitch slut anyth like call dumb caus,1
gonna love girl eighteen delici nude pussi dick cock nsfw fuckm cum,0
lesbian game cumshot quick creampi quickest handjob black bondag russian lesbian l x89 co yonnizkn99,1
wait til bd tri come back around ava older call kordel instead dad hahaha bitch,1
mad let stopshutdownnow bcs usa place inharmsway amp usa credit rate mayb downgrad coul,1
terridelcampo ava eveew kenidrarwood blackenterpris fredtjoseph ze cool coconut notmyhair compromis,0
rt oh bayi 5 day wake pop bottl champagn lay beach miami slut ass friend,1
girl crush sugar babi slut therefor idk gonna live life,0
sassi bitch today lol,1
gay teacher school fuck danni montero amp amp n co uknip4c0b dadtw x89 co llbspuphdl,1
check ad closet poshmark v neck glitter sweater tunic ava amp viv 1x,1
rt thisisfckinghot milf love ride cock ride milf blond boob fuck cowgirl slut,1
h neli whayev fuck stupid piec fuck whore asshol slut n n 2 hour later naya x89 co lczdk9aybo,0
annysscountessa use power spread could spread posit characterist x89 co 8ni5zscryj,1
babyxhyunjin macawhe rbw mamamoo bias get wreck bias wrecker wil,0
johnzag msavaarmstrong techwraith briannawu even californian amp new yorker room temperatur iq,0
rt nkjemisin thousand feder worker risk lose everyth food stamp recipi go hungri peopl feder hou,1
bitch grow childish slut mindset one,1
rt taddeov never understand girl slut shame girl male friend,0
motherboard whatsapp facebook nsagov civilian code amp us superior code break,1
lulu sexbomb hardcor video movi andhragroupsex teen bitch parti colleg romanian group sex,0
moneysugardad sugar sext seller ndm seller slut choos girl,0
ugh wish mushi could bad bitch slut,0
rt chrismwilliam took 3 day write goe let finish job amp honor friend ava funer sat ht,0
rt swiftlyinstyl taylor releas song call break girlfriend bore would liter slut shame canc,1
squirt queen get fuck anal creampi porn nsfw orgasm wet horni pussi sex porn video xxx rt,1
ava oprah director name thank amplifi,0
lol funni girl would bulli call slut hoe shit singl babymomma l,0
fuck ava korea racism peopl blind recogn chines boi,0
krassenstein donni interrog wrong usual x89 co 6xxvkvbbts,0
