text,lable
go ami tyson tyson,0
go boy perfect quail way,1
go boy beat te nerd whooooo,0
go bree jessica kid,1
go carlin lauren stress feel guy,1
go car tresn send posit vibe,1
go dan amp steph,0
go david n betti faith,1
go deb rick,1
go girl love authent dish,1
go girl smash kat amp andr,1
go greek alway fave like helena vicki,1
go helena amp vikki girl great,0
go helena vicci go girl,0
go karen ros know get bun oven,0
go mell cyn noth wrong confid,0
go nev kel got nev,1
go post recip tailless fish,0
go paul blair know,0
go rosi page even tho boy hot im go,1
go tassi girl hope main even better entre,0
go twin youv got,1
go vic boy come,1
go valeri amp courtney worthi winner though,1
go amp steve put sydney map,0
go steve amaz start night keep good work wish could tri,0
god hope kelli chloe massiv fail tonight pleas make cri manu,1
god earth joy give offer oneself other greatest joy aum namoh bhagvat pavananandnaya,1
go close team amaz cook ill sad see either one go,0
gonna make mkr mini backpack crew,1
good th grade work nerv daili lol,1
good luck ami tyson hope get see angri angri man,0
good luck mkr sa final,1
good luck guy cook hope food tast,0
good luck mitch laura food sound nice,0
good morn guy dog children boy girl sale kid realli puppi sale,0
good morn info sec rock unabash posit stolen,0
good morn world got coffe got someth eat got wit right let,1
good morn world built couch also appl give point halfway,1
good morn world woke find one best friend evacu due wild fire safe sa,0
good morn world iss ya bitch,0
good morn world new week new possibl dust get readi hit ground run let go,1
good morn world monday return real life holiday weekend us deep breath,1
good morn world sunday mean relaaaax today hold hope everyth want let go,1
good morn world oh sorri bit loud water aspirin ill bring bagel whisper let go,1
good morn world halfway week look fierc today stardust vein gonna,0
good morningafternoon world alreadi bit whirlwind day there sign slow,1
good news iraq parliament report drop amend would let girl young marri congrat,1
good serious sibl amytyson,1
good hear back fat delicaci ive alway quit conscious mine,1
good see tradit cantones cuisin happen tonight,1
good see girl dress tonight,0
goodby good riddanc jessica amp marco,1
goodluck team im excit see get grand final,0
googl spotifi know shame,0
goooo ami tyson cant wait see u guy produc,1
gooooo ami tyson deserv start,0
got love paig shes best,1
gotta love org invest btc get travel dalla style,1
grammi u one job son bitch,0
grass shit prob,0
great contend mitch amp laura give,0
great cook wa team keep go prove pete wrong,0
great fan mkr australia mkr uk old fashion judg bore pru say cook bad make h,0
great job sauc time cook less time critic other,1
great look food jac shaz hurt ear,0
great mkr bitch dunno time,1
great sex marriag pretti girl tgp,1
great show tonight love foood,1
great stuff ruin tomrorow sudden death ad announcedwel done,1
greet china great wall person actual pretti good say least nuff said,1
grow moani littl bitch,0
gt ed sheeran gt ricki martin gt music,1
gt celebr amp also dont compar other courag tackl everyth,0
gt wake gt cannot roll cat sleep problem,1
gtwake gtroll get better sleep posit gthit corner someth gtull two book arm problem,1
gut joshampami still go shock rest competit,0
guy talk shit mention girl yall bunch bitch made ass boy lol,0
guy first time maka first mkr poweeeeer,0
guy r gross girl get period lame im sure mother pray get got,1
self proclaim fashionista collect dollar everi time said word moussaka theyd left millionair,0
get entir organ mkr look atew,0
hahaha know feel well,0
hahaha third tweet goe amaz bitch legit makeup skill never fail make laugh,0
hahahaha would probabl entic pickup line marri,0
hahahahahaha ya right man right,1
half shit tweet song lyric hit googl listen banger u judg bitch,0
handl bipolar mare assert best result quit lil bitch put ear forward,0
hang court duncan,1
hani everyon mother stop act like man,0
happi birthday maama miss,0
happi birthday love fire magic knight hikaru shidou,0
happi birthday world wide handsom jin,1
happi distanc biggest obstacl keep girl schoolso im join help give,1
happi here strong women may know may may rais,0
happi man captur first love woman happier woman captur last love man,1
happi nick one excit amp clutch point guard ever,0
happi thank women everywher help creat wiser stronger kinder amp hap,1
happi sassi women classi women nasti women fine women aliv women gonna fight,1
happi strong fierc women globe,0
harri christo fishi fish hope well,1
line inspect ever life help,1
blast far didnt eect draw mani commiss rendit pl,1
begun stream first episod free cw app,0
given away sudden death team,0
jake anoth realiti show resent past,0
declar undisput smartphon brand across top citi india e,0
go mkr popular realiti tv show everi singl year,1
hashtag hashtag two way itthat betti smokin hot,1
hate peopl think still lie bitch idc nomor,0
hatr born mistaken idea peopl caus suffer,1
much knowledg depth love watch journey,0
told season talk dont mind chatter absolut sheer utter bullshit,1
dinner watch msg enhanc said girl point,1
haybo mkr ayenzi sens tu kengoku fact public particip consult necess cant pass,0
champ thou champ,1
ask isra l u respond bakistan,0
current play anoth team refus play sea,0
face brand state sign team see problem,0
look like whisper ear smile bitch look like happi,1
stole welcom xxx,0
usual start rotat lmao,1
heatherampmitch mkr new zealand horribl woman bitch everyon everyth pleasant,1
helen rowland take woman twenti year make man son anoth woman twenti minut make fo,1
hello everyon love mkr cant get enough spici sausag look amaz keep go guy,1
help id man want rob two teen girl near surf avenu west street call info,1
henri truffl farmer back mkr next year yay,1
work make rethink plan move mt vernon pick remington instead,0
basketbal theme everyon need season support boy girl team see,0
here tweet show tv,0
here artist breakdown good know absolut domin,0
here line chadperez jordanbrunomkr,0
chanc win flagship smartphon choic follow rt tweet,0
hes got full bowl water insid still,1
hey folk hire remot junior develop junior infosec role great candid vouch,1
hey guy go fa lf decent team play subbi role ar hard get use ever swi,0
hey stay fit drink diesel id say good life live,1
hey bout stop let team know score strateg vote find end round,1
hey littl month sinc season came that pretti good,0
hey alway worth say nice thing appreci,1
hey manu panko egg father god may disown,0
hey play thank heaven littl girl mauric chevali,0
hey quick question player face scan forest green rover promis releas,0
hey tim your cook,1
hey two dalit girl got rape within last week rajasthan constitu cm could u report fict,0
hey talkin bout,1
hey ad make want watch,1
alway high meh,1
hi aarti sincer apologis broadcast wrong promo ahead tonight episod mkr sa,0
hi bonni sincer apologis broadcast wrong promo ahead tonight episod mkr sa,1
hi dad also food look yummi,1
hi derek sincer apologis broadcast wrong promo ahead tonight episod,1
hi guy last episod mkr load catchup thank,1
hi judi sincer apologis broadcast wrong promo ahead tonight episod mkr sa,1
hi kim sincer apologis broadcast wrong promo ahead tonight episod mkr,1
hi mum cook like u keep go girl,0
hi ronel sincer apologis broadcast wrong promo ahead tonight episod mkr sa w,1
belief good life childlik enthusiasm infecti,0
fix minut,0
mustach look like lil weeni dog kiss,0
hmm hydra circular saw blade head,1
hmm idk white girl make love black bitch jus get nastyy nd mix bitch use much tee,0
hmmm true asli color ab dikha hai,0
hmmmm interest im work australia futur probabl join mkr legibl,0
holiday hobart go tassi girl,0
honest anyth built electron,0
hope ami tyson come top tonight,1
hope anna jordan well tonight hit top board,0
hope fulli desert better ever,0
hope get anoth event like year heyyy selfi,0
hope nev kell cook great main dessert,1
hope tasia gracia arent sudden death gianni zana might go sudden death,0
hope boy dont go miss piggi need go back pen,1
hope boy score higher wa brat,1
hope marri lawyer well complaind better cook lol,1
hope salmon cook girl amaz,1
hope girl good realli dont want go make main dessert amaz girl,1
hope guy fantast job,1
hope get food cook time,1
hope okay look like youll good darn want lemon tart,0
hope get dessert right,0
hope guy well menu sound delici youll,0
hope zana mouth doesnt get tie knot facial eress,0
hope privileg american bitch ab everyth see shit mayb someth ab,0
hope octopus tentacl slap look zana face,1
hope tabouli doesnt make look like fooli,1
hope twin evad disast go twin,1
hopefuli boy realli good tonight,0
hope fondant awesom nice gooey,0
hope see spice girl crash burn,1
hot ethiopian girl porn pictur hentai adult comic,1
hot flash girl gif pinup girl nude,0
hot girl finger free sex teen video xxx,1
hot take start call jay man finger gun everi singl time say name,1
hot tip add hella mix tell someon love shift mood away ooz vulnerabili,1
reveal score end stop strateg score score base food rank,0
joshampami still know cook laksa,0
girl straight like limit urself worst speci aliv,0
calm food look great,0
ugli girl win beauti competit must one compet year,0
think good cook fish serv disappoint,0
guy score two love ladi,1
get shot without telescop,0
disappoint score dessert describ cardboard,1
girl rememb guy said month ago pm even rememb put bobbi pin,0
u stop compar urself girl,1
bank manag get girl like doesnt seem interest,1
team make final gravel dish didnt realis mud pie,0
josh ami got ball criticis anyon disast alys matt better bloodi good,1
mani time tweet bts,0
mani time film face boffic clash see full list actual full ht,0
word caiti demi mani time say word moussaka ive never heard insan nonsens two peopl,1
could feel like man know girl provid everyth la dude hustl,1
howev say player oblig pla,1
huge nake cuban girl fuck old guy,0
huh case ive definit flirt wrong,0
huh ive never actual felt one idea eect,0
huh peopl actual felt someth sure didnt stylist thing razor,1
human never need let world know,1
humbl team cook great best tonight,1
humil virtu weak strong need mistreat other feel superior,0
hyungdon rais bts defconn jimin grew watch rain joke jimin role model,1
absolut hate food eat guess go cook show,1
actual miss part mkr get guest judg home cook get actual take part pres,0
ad video playlist brain heal sound heal million alreadi must tri,1
ad video playlist full chakra heal spa music w binaur beat isochron tone,1
ad video playlist greatest buddha music time buddhism song dharani mantra,1
ad video playlist instal setup arduino mkr gsm wan arduino ide,0
ad video playlist ivanka trump presid introduct,1
aint snitch nobodi give month send way lawyer nah your actual look minimum,1
hang bitch gotta keep eye lay hand let alon fuck w bitch im fond,0
alreadi know new zana go,0
excit alr next although katrina scene togeth love work shah rukh,0
fascin yoongi laugh chang serious bitch face immedi real talent,0
go cri soon,1
grate dispos nicotin vape fren convinc buy sneak puff,1
like top tier team dont attend wast time,0
go hold anyon given wrong intellig eect verbal bitch slap though,1
realli look forward ami tyson food alway esoter,0
damn thank oh god realli save girl help get shit,0
mad right kat andr bad loser deserv cook show game,1
sick amp tire attitud oh wow your smart girl,0
squirmi unhing ultim useless affect wish flung sun,0
queen chip,0
tire shit piss asshol mkrs,0
watch mkr new zealand season hope moari women win favourit,1
worri risotto,1
appreci everi one uniqu trait abil great admir everyon interest per,1
appreci everi one uniqu trait abil great admir everyon inter,1
ask bfs fake ass want christma keep say like bitch u alreadi u blind,1
broke stori nsa domest surveil program target us citizen nobodi care appl fuck u,1
tell skill,0
never call jaym brain wouldnt regist alway high kite may,0
relat court today,1
cant believ mkr team got elimin waaaay final episod got harvey norman ad oven wtf,1
cant go hell im alreadi bitch,0
cant stand old guy hes horribl,1
cant watch show anymor caus josh,0
complet agre case grant abl fire easili,0
thing met derbycon complet butcher name w,0
didnt know mrs doubtfir cook tonit,1
fall bitch fell back,1
die thenk resurrect kiss,0
dm bitch mla format,1
well put ice tequila practic slushi,0
dont care jess care osso bucco,0
dont care hard think cant act like man one respect,0
dont care im go watch video everi singl time come timelin,0
dont even know support sd love team,0
dont know direct lineup attend,1
dont like kelli mkr pleasant,0
dont like seafood look amaz,1
dont like friend bitch bf bitch gtf,0
dont realli even want look,1
dont support bc support strong selfassur hard work women dont need day self piti,0
dont think jessica know carb,1
dont understand kanter tri beef lebron like jim jone make diss track jay z,0
dont want lauren go,1
know guy get amaz girl complet take grant wast opportun shit make absol,0
normal chase boy ft good hair bitch might powerwalk,0
think pennsylvania,0
trust anybodi like rock,1
eat like man old news,1
eat like man terribl,0
enjoy profil legitim cite marshmallow,1
feel like phoenix rise ash,0
feel like girl forget alway treat like queen month year noth chang,1
feel like could gone month amp singl person would notic,0
feel like sound weird girl cuss think sound like go murder someon,1
feel like contribut sarcasm thank,1
feel like redund sure favour one,0
find josh realli funni hes smug bastard,1
one enjoy liquor slushi,0
forgot book bitch listen shinedown like miss steph enough,0
fuck yo bitch ironi ill send armon yo hoe yo bitch keep eyein,0
gave icn girl hellllll last year,0
genuin want bffs ami tyson,1
get inspir thirst life alway slay live life,1
get everybodi talk world,1
gravit toward blanco earthi tast need bring cimaron next time see,1
koo ass dream dat bitch real,0
hate bitch give uplik bitch wat u got,1
hate stupid twin let pound thing cook minut noodl,0
hate girl post girl makeup pic tryna sis dirti like,0
hate peopl ask drink much water like damn bitch im tryin drown think leav alon,1
hate ppl post wcw mcm like wednesday right monday right bitch stop,0
never heard much pointless irrelev pretenti chatter two peopl mel cyn total bore,0
fuck idea use bitcoin refus bitch ask help lmao,0
go rehab got josh cook alcohol addict,0
know camera man spend whole day take various action shot clock,1
havent eerienc ive seen flood msgs take like second,1
ran fast sinc,0
hear dont eat die here hope someon elain without would n,0
hear least xweek neighborhood itll never leav,0
hear talk bitch specif,0
heard set word kid meme confus old dont realli care poem wel,1
hesit ever call sme anythingexcept hug im goddamn phd hug,0
hope everyth turn ok,0
hope iu jungkook collab one day,1
hope continu carri mkr ive see rerun season love,0
hope chicken lace multipl form ebola ebola sweet tast,1
hope girl well tonight menu sound delish,0
hope baben mama win,1
hope boy blow cupcak sock amaz dish,0
hope u get comp im sick attitud dont u shut amp stop abus other,0
hope uel shanell stay tonight,0
learn tv tuv switch sigcheck list trust root certif werent e,0
look mine long lol realiz,1
lost point win fuck yes better feel climb rank,0
show everyon tabl,0
watch open jar neither could open ive never felt emascul,0
woke still look fuck great good littl bitch boy send breakfast say noth ive ea,1
keep see mkr vele,1
know lot man dodg karma think laughter till bitch come kiss,0
know rt noth like man fine women pretti feet great pair shoe,1
know theyv wait along time serious lama amp sarah alreadi serv dish hungri,0
lightweight miss cupcakin otp night enjoy havin worri anoth bitch ass nigga playin,1
like team ashle sophia favourit go girl,0
like girl like girl attract,0
like girl like like honeyyyyyyy,1
like switch genr everi two minut,0
like think strong independ woman cant deni fact feel damn good taken c,1
like video crawl one light live linkin park,1
like video youv got strong grip girl,1
like video mkr ralli truck ride hendrickson spring,0
like video wymarzon rankedi mkra hearthston extra,1
listen music whole bunch,0
look girl butt time amp like dang didnt get bless,0
looooov good fresh baguett ciabatta,0
love get lost citi random get inspir beauti street art,0
love mkr australia nasti one,0
love bitch ass clown,0
love pavlova let hope pete manu still like crack,1
love pretti girl friend ass look smile wanna stuck bitch ugli,1
love tasia garcia hope win,0
love dish manu,0
love yuri ice,1
love chak de india swade like film anushka sharma,1
love like man love woman never touch write keep littl photograph,0
love like man love woman never touch write keep littl photograph charl bukowski,1
may messi bitch never forget,0
mean batman doesnt swag clad leather offic either jus sayin,1
mean good purdu field big ten titl game id like differ capac,1
mean rule realli shouldnt hold grudgeunless honest deserv your good,1
meant add amen end,0
might hoe bitch,1
miss mate alreadi mkr,0
miss still favourit team,0
miss one check hate sleep,1
need man man act act like man,1
need man act like man bh pareil,0
need answer feel like man fall guy,1
need girl model upcom project whos eerienc need get free pictur,1
need find dvd interstella,1
never claim anyth,1
never thought hit period life would consid buy mope,0
never watch see,0
answer kim,1
let spite dictat cool thing anoth goe prove ppl wrong,1
mani blanket think ever reach point mani blanket bc bitch never warm,0
part way also slow slow definit worth,1
person prefer that,1
pinpoint exact moment millenni humor becam sort fuck weird vagu disturb humor ver,0
promis girl masturb still talk shit,1
promis im much closer gif youd think,0
put ice margarita enough tequila way,1
realli never relat mcfuck cartoon charact bubbl powerpuff girl,0
realli hope girl good desert,1
realli hope end road kat henchman,0
realli think bitch gonna pass fuck day get engag marriag beauti like choos,1
realli want cheer ami tyson courtney valeri love cook wonder lookin,1
realli would like see boy get challeng go miner boy,1
rememb good show havent watch sinc travel made thru store brought food,1
report havent seen self delet messag,1
saw jennif today crownlol stare,1
saw mum shade tearsi saw love herbut time declar rockno one could separ love woman,0
see comment say could congest swap carrier even buy router,0
see point im say effect distinct contract woul,1
sign amaz race mkr see strong relationship bf exanpl,1
slept irl girl night put categori telli,0
start youtub year ago love still talkconnect girl ive known,0
still idea mkr mean,1
swear think im still use eduroam mkr,0
swear peopl show bitchi wanker,0
swear part steve hair move across head everi episod,0
swear mfkng gawd cut bitch give masseduct grammi next year,0
take backi take back alys amp matt top hatelist,0
talk shit bitch gone shit make sub run next bitch eress hate,1
think terrif turkey need man bit honest includ,1
think look cute thiz mite delet doe,1
think see trend call bitchi seat lhs front pete,1
think leo girl think lot like man need alpha,0
think mick amp matt fave,1
think mirror convent sport seasonstimelin could step right direct execut well,0
think qld year,1
think mean cryptonomicon that good book yeah sevenev long one,1
thought got head guess,1
thought wear seatbelt shoulder,0
tri elain mom spacex wasnt impress appar older peopl,0
tri use last year wait hour driver mkr,1
tri let everyon know upfront arent surpris level emosh subsequ tear,0
use let bitch get reaction bc ima mf hot head pop regardless come realizatio,1
vote mari island,1
wanna go hous dinner,0
wanna girl eventi need friend,0
want ami tyson win caus best round cook allison,0
want black vampir black girl stumbl upon ancient relic grant magic power want black spi,0
want play poker zana,1
want punch drasko face hes serious annoy,0
want slap spice girl,1
placement someon dodg pick map got l minut,0
write vim one,1
lay like ahhhh noooooooooooooo kept laugh spooki good,1
pictur dinosaur depict stellar bodi,1
rais hustl like man bc told never depend one,1
rais hustl like man id never depend one,0
struggl get time figur first place,0
lavar first ruin boy live soon someth go way pull em,0
wonder shrimp equival odangoatama wish could see fight evil,0
alway judg friend type porn watch,0
never good use fabuloso air freshen lol,0
wish wa eat,1
wonder mani suit own,0
wonder go rival grand final,1
wonder kfc still open,0
wonder manu speak french head,1
wont particip absurd suggest women less import men dont e,0
would thought someon work liter ocean like josh wouldv cook catch,1
would love prawn,0
wouldnt made mar without women day without curios,1
id bing least episod old noodl man sailor moon,0
id thought alys would taken cue lauren mkr learn shut fk overbear loudmouth,0
id let deb boil rice,0
id like see five star cook knock perch,1
id much prefer team public show ba,1
id never blame place gave tequila last night,1
id never say die theyv around long,0
id say ask team your vsing,1
ideal theyll replac one im send back wont need spend money new pair,0
idgaf bitch prettier better bodi think im shit dont give fuck wh,1
bitch still textingcal nigga dont dumb sis talk,0
woman marri good mansh happi lifea long ambiti,0
alys amp matt dont deliv theyll never live price arrog steep,0
cute ass girl feel like take thigh pic need someon send dms alway open thank,0
ever see bitch person im go trip,0
tell u got girl dat mean leav alon dumb bitch,0
hair rule jake would win,0
jess fit freak drink alcohol go italian,1
kim k pull help set girl freea bitch might buy gotdamn lipgloss someth,0
l hear word point one time l swear may simultan combust,0
l younger client horribl woman law firm id think truli think younger generat,0
bestfriend like u bitch hate u,1
warm meal longer warm interrupt dont forgiv forget,0
josh put much effort cook heckl court duncan,1
sheri would smile look sour,1
isnt gym song dont even know,1
that believ good bother compet,0
player contract play game organi,0
spice girl stay go,0
want puf wheat sell box cereal aisl,1
u alreadi realis ur one org actual care player u stupid bbi,1
u love aman mathur angel year kal ho naa ho,0
u plan go boy game tomorrow girl game tonight sincer hate u,0
go idea feel like would need hydra cute factor monoc,1
talk bitch limit shit say social media,1
stickler detail alys wooden utensil left pan,0
care girl bodi count realli go sit corner wait year readi,1
disrespect femal yall broke bitch,1
dont like bitch nigga lame,0
dont talk talk fan bitch,0
go houston amp got chris paul amp jame harden think coach go give fn ball better l,0
ps3 junior high high school argument free onlin broke bitch,0
get rid asset contract make sure adopt new mkrdai model check,0
get rid asset contract make sure adopt new mkrdai model check,0
bitch dumb bitch,0
think sexual harass real problem like make joke peopl get harass,0
dream job chef apprenticeship,1
ex text sign get back togeth test see still weak bitch,1
your mad school district could close recogn women backbon educa,1
ifwhen rogu speak regard issu,0
ill get address jaym,0
ill host get record viewership,1
ill pass real women dont abandon respons,1
im woman dont want superior men equal want treat digniti respect,1
im pea tension excit,1
im actual pretti tall girl man still pick like thishowbow dah,0
im back stand realli smart box power mkr fox,0
im back stand realli smart box power mkr fox,1
im convinc girl talk shit girl dont masturb that theyr mad,0
im definit relax most stay sunris friday yesterday,1
im victoria behind tassi boy way could find genuin pair,0
im glad rememb pick right one total cant rememb app,0
im glad aliv take care,0
im gonna hug hard,1
im guess might ed sheeran ricki martin eh shame music game right som,1
im happi realli werent nice peopl amp couldnt cook undercook thing,1
im hype bitch fuck think next subunit like demigod,1
im way defend cg event couldnt give,0
im glad dick dont come caus nigga steal anyth daysid like bitch u dont bring dick back,1
im gonna perpetu draw two stuff togeth break work,1
im happi team make treck,1
im kind meh kid hous im use eat last cold,1
im low key judg least song,1
im cri your cri thing make derek swear rain door,1
im even disappoint biggest understat centuri,1
im much twitter user soon mkr fire back sa boy kill,0
im sure blind bake tart,0
im shock appal let eat entre first,1
im glad josh epic fail hes douchecano,0
im glad like,0
im sorri couldnt stop,0
im surpris funki monkey face arent make reappear,1
im surpris two suppos profession ladi like mell cyn would want come across arrog bitchi,0
im think divorc menu desert,0
im think best interest guy dont,0
im tri grappl one get scenario wherebi one tri dec,1
im tri understand josh ami still competit,1
im tryna bake pillsburi christma cooki bad bitch follow spontan wild festiv holiday sex,0
im wait see desert first good,1
im watch realis much im miss australia famili lip quiver,0
imagin sesithwanyuza ngo tight etown mkr okim bethuna,0
imagin world without women imagin wait first placeto imagin,1
world full kardashian ivanka,0
day beauti ok thruster fire space first time help guid mar rov,1
case thank appli pressur,0
astronaut stori musgrav jeffrey hoffman began first spacewalk hubbl first serv,0
australia think said th mkr show sooo far away,0
