text,lable
RT @mike_pence: Touring the historic Gettysburg battlefield—the site of the Civil War's bloodiest battle. https://t.co/nB1TY8l1O3,1
"RT @20committee: Politics would be a lot more pleasant if we accepted espionage realities -- and Trump+Hillary stopped lying so much.
https…",1
"RT @TrumpPence2020: Dear #Hillary, come see the faces of real #Americans  https://t.co/xHorUjyOWS https://t.co/clhIROVpsM",1
"RT @sonsandbros: Happy B'Day to mother, organizer, political commentator, Hip Hop activist, and former Green Party Vice-Presidential candid…",0
"I love to see some Blacks starting to wake up! 
Spread this pic! MSM won't show it! https://t.co/qn1Np7VBOe",1
"RT @CarolLe84828745: @MoveOn @realDonaldTrump Don t u mean Bill Clinton, POTUS doing what he did in Oval Office???
Say it the way it is, OK",1
"Another example of libs opposing free speech. LL Bean are working, you liberal brats should try it too some time!… https://t.co/4I8Z3KwPTf",1
RT @sailmom: @ArtHauntsMe @ezlusztig men really do not understand pregnancy - and pro-lifers do not acknowledge the truth,0
In '08 Hillary said she won't drop out of race because Obama may be assassinated. It wasn't about the 2nd Amendment. https://t.co/nXgjgAMJsT,1
RT @BoogsMalone: Aye bro! Listen to my latest beats and hooks at https://t.co/HD2IWLWYvB #Beats,1
"RT @usgunviolence6: How racist is America? - ""The Two Races in America"" https://t.co/Yf5UVhZote #p2 #2a #BlackLivesMatter #gunsense https:/…",0
#GOPDebate Stop being ignorant. #GunControl simply will make our life safer #StopTheGOP,1
RT @ShelsABoss: Sometimes I wish I knew what I was getting myself into before I started to care this much.,0
"RT @catsofinstagram: From @instafelix_the_cat: ""Logan being dramatic"" #catsofinstagram https://t.co/r6Jsvb555i",1
RT @AllenWestRepub: Sean Spicer Spicing Up the Airwaves? https://t.co/17XrdpXJvT via @conservativebyt https://t.co/Gl1v9aXczF,0
"Happy Birthday, George Washington! May your memory never fade.  #HappyBirthdayGeorgeWashington https://t.co/QKfEwuticy",1
RT @backyardconserv: Did he care about #SuzetteKelo? No: Supreme Court needs judges like Gorsuch because America has leaders like Schumer h…,1
"RT @theordinaryman2: You laughed at us &amp; now we are laughing at you ..

#DonaldTrump #NigelFarage #Brexit #Amexit #PreidentTrump #UKIP http…",0
"Data shows NYC’s 'Stop and Frisk' doesn't work.
https://t.co/SWIAx9koL3 https://t.co/XZjgG0a6ps",1
"#NoCyberCensorship a thought to China's great firewall, the biggest censor in the world https://t.co/uhPteC61My",0
"RT @wweTheBeast2015: What 20,000 pages of hacked WikiLeaks emails teach us about Hillary Clinton https://t.co/4rHPz15RnD via @voxdotcom",1
RT @tonystubblebine: @LouisatheLast @FeministaJones Feels both stupid and unfair with Rs not approving Obama's SCOTUS nomination. He's stil…,1
"RT @RealDrGina: .@SeanHannity destroys the unfounded claims in Obama's Farewell Address. ""A disastrous legacy""  https://t.co/yrzOrS9uCb",0
Gabon names new government after winning disputed election  #world #news,1
RT @CincinnatiDays: Remembering Reds pitcher Jim Maloney's no-hitter 50 years ago today at Wrigley Field  #sports,0
@realDonaldTrump @tedcruz Thank you Donald Trump! We love you!,0
#IStartCryingWhen I realize that Hillary or Trump are our presidential candidates,1
Obama is mad he got whipped by the people a few weeks ago and now he's going to troll America for the last 2 years  #IllegalAmigoz,1
Obama gets the crowd laughing http://t.co/4cSMukGLIH,1
RT @kadyalexis: ICE Officials just told Trump that illegals are being allowed to vote &amp; that's why Obama won't deport criminals. https://t.…,0
There is never going to ever be a better show than Lost.. #TweetsFrom10YearsAgo,1
"US admits high civilian casualties in Manbij airstrikes, Says strikes must continue anyway.

https://t.co/kozz2Nxrkm https://t.co/kWIkjjgtWA",0
#2017SurvivalTips don’t forget to do sports https://t.co/pnqRtCpJ4I,0
Take a look at this 'brutal' cop👇,0
RT @WorldLatinStar: HAHAHA #EPICFAIL TV Host Edition when telling #PrinceRoyce That he won a #LatinAMAs Before But… https://t.co/QGUXwH0rLm,1
RT @richposlim: Being trifling https://t.co/vbVXmefxIF,1
"RT @kylegriffin1: Clinton campaign manager @RobbyMook has sent a message to supporters: ""There has never been more work to do."" https://t.c…",0
"RT @ProLifePolitics: ""A pregnancy is not a baby."" ? What do you think women are pregnant with? 🤔 https://t.co/Y9cYEL4E7q",0
Trump Video Fallout Spares Him Punishment of Most CEOs  #politics,1
RT @ReaganBattalion: Breaking: Trump is set to announce that he has convinced Amazon to hire 1000 new workers right after he finishes readi…,1
RT @nenelilly: Report: FBI Russia Probe Failed To Find Evidence Against President Trump https://t.co/I2S5wukULm https://t.co/DvX7HzKjcC @Da…,1
"RT @identicaIs: Working on myself, by myself, for myself.",0
RT @realDonaldTrump: Beautiful morning- thank you @ICLV! https://t.co/xzJhrLgjHP,0
RT @andersonDrLJA: #Crooked HILLARY HERSELF HAS SAID No One Is To Big to be Prosecuted &amp; Sent to Prison SO BE IT! #HillaryForPrison2016 htt…,1
"In a year of #OscarsSoWhite, a Mexican film-maker quietly dominates the #AcademyAwards #OscarHasNoColor https://t.co/uKR…",1
RT @FemaleKnows: I'd eat all of it 🍍🍉🍇🍊🍎🍒🍓 https://t.co/qlja2jkzFX,0
"RT @saracohennyc: DNC screwd pooch by fraudulnt behavior to elect Hillary, selfish corporte puppt #JillnotHill Don't promte corruption http…",0
"RT @Chris_1791: Man Up, Campus Christians—Your Timidity Feeds the PC Beast https://t.co/Z4iqEUTjyA",1
"RT @daniecal: But then I remembered a lot of religious texts have been used in the past to assert the same thing. 
So I try to temper my ju…",1
RT @Trafficboutique: Somebody shoulda told me it would be like this...,0
RT @christinagausas: .@POTUS stop the pipeline and demilitarize North Dakota. Please don't leave this to Trump. https://t.co/rzdHGAAlfs,1
Girls think they can't shave their legs #ChildrenThinkThat,0
"RT @LeahRBoss: Who will run the country when it's over 78 degrees or after 8 pm? 

 #ZombieHillary",0
RT @coasttocoastam: News segment guests: Lauren Weinstein https://t.co/W48ODLOZK4  / Mish Shedlock https://t.co/56qCje75je,1
RT @ajplus: There are now more than 45 million slaves in the world. Almost half of them are in India. https://t.co/hz2UqdHSAq https://t.co/…,0
RT @KeshaTedder: #MakeAMovieCaffeinated Mocha ado about nothing,1
RT @BlogOverwatch: U.S. lawmakers to examine worst-ever bird flu outbreak http://t.co/sYKzB2IwGv,0
"RT @DANEgerus: Democrats insisting Trump is Hitler should explain ""National Socialist German Workers' Party"" Nationalsozialistische Deutsch…",1
"RT @PrisonPlanet: Hillary campaign plays """"I feel good"" by James Brown as she walks on stage. (James Brown died of pneumonia). https://t.co…",0
"It is not how big you are, it's how big you play. -Unknown",0
RT @TYCASHH: Stay positive and good things will happen.,0
RT @myteks: #FIFACongress Joseph Blatter #FIFAelection #FIFA #Blatter #FIFAgate #FIFAcorruption http://t.co/WAITXOac7F,0
RT @ZunRa: C.I.A. - Cunt Is Alive #AlternativeAcronymInterpretations,0
tweet_content,1
rt glossphoenix never watch collect fuck bratz movi show,0
omg believ sell dropbox folder w 150 nude amp 25 video amp dming live nude f,0
asa akira ava lauren beach sex free porn video french anal ftm porn fuck hard matur sex milf anal pokemon hent,0
anyon sassi smart mouth cuuuuteee old favorit word x89 x89 amp x89 boo x89 x9d x89 sh x89 co aqxguisj2x,0
scare karma got know gonna bitch babi happen,0
need today x89 gettin swear right,1
cutest littl night couldnt sassi,1
tit mouth offic lesbian eleg creampi eat quickest cumshot hentai sm x89 co 0kwsjlkz3m,1
absolut sonya hadil c mkraustralia,1
heard homeless woman twelv x89 x89 slut wear x89 co 3fy6kxcvkx,0
love bbi rt like singl girl boob boob camgirl cumtribut fuck hard fuck hardcor,1
tristan thompson nastiest skank bitch ever met trust fug slut,1
tfmonkeyyoutub bitch problem doctor philosophi sake hard world chang x89 co ivhksm6bjp,0
noah slut tsunder girl dorki guy pair,0
fatma a3arfch 3adl tweet point amp ava 7lu,1
dress would everytim th x89 co ntpr4wfnah,1
rt yfc zobel last entri camp year camp zion held februari 15 17 loi collect friday jan 11 h,1
meghantonj video take alcohol someon x89 foreskin take twitter break,0
indian pussi eboni deepthroat cumshot beauti drunk fuck gypsi nurs porn x89 co k054mahmpo,0
kim kardashian 32 amp amp pregnant hoe 16 4 kid babi daddi yall call,0
realli fuck peopl gotten justic deserv age ago,0
lewdemberkitti mayb show princess get dirti far entic hope,0
slut suck one eye monster insid car n co pspvu44t0t aspenra hardcor gladiat sandal b x89 co idkxsu48fa,0
po cup fuck slut bitch,1
ofsevit skoczela briannawu doubt learn mistak one fail campaign mean p,0
pleas know defin hoe slut bitch confus,1
realdealbarn colleg goal straight make money amp wild bless,1
ball wouldnt manag huge feet pure totur littl cum slut foot slave bitch humili,1
trump one separ famili amp put children cage foxnew foxandfriend seanhann aarp cnnbrk,0
gai4ubb x89 stop shame x89 bitch gross post someth person make peopl uncomfort disappoint x89,0
rt coloss upcycl lobster shell transform function planter packag,0
blowjob gif bj surpris slut skill,0
jocelinecam librari x89 x9dwhat x89 point halloween whole point slut x89 x9d n nme choke cheeto,1
acowboykil jakeharden19 sophi mhj imagin think slut still valid insult,1
vid gt gt today brazzer histori februari 21 2014 veronicaavluvxx amp keishagrey wa,1
eximind amp ben stone join forc cassiopeia excit new trancer turn,1
happi birthday sassi co 6jhmej3rfb,1
amp booom ava lmaoooo,0
realdonaldtrump educ intellig peopl approv rate pull colleg educ x89 co iudeme11x,1
pic com shaun slut nude teen porn pictur hq full screen drunk girl anal mid school cock girl skin porn ace,0
lmfkk bunch shame mention x89 contact twitter x89 co watb15zvi,1
rt parisdennard pretti sad hollywood joke real instanc human traffick sexual exploit amp victim women amp,1
rt karlnew74099518 shamima begum let break name sham im beg um say realli sham british,0
rt jraw0 twitter bore hell noon amp unemploy peopl wake bullshit,0
x89 would server x89 x9d n nlol trynna sassi bitch server rather octagon,0
jwarfir bitch georg georg washington lmfaooo,0
white sassi polit teacher talk trump,0
charliekirk11 kampala harri realli believ chanc woman blackish,0
man immedi call girl slut whore bitch etc fuck respect,0
ava amp abbi talk one drunk scream lyric head bimtrimm softpeeb,1
yourcutekot mean stupid men consid girl big breast like slut smart men consid,0
retweet boost amp tweet ibjiyongi chefresha eveew thewayoftheid tylerperri kevinhart4r katearonoff,1
thegirl youhat stubbornn girl sassi soul mailpp someon hate,0
bitch forgot charg laptop take lectur note micron liner sketchbook like dumb art slut,0
gandler call meet hype ateneo fan built bein,1
rt sneakygirlfrie1 feel horni send surpris anyon retweet slut teenslut bbcslut bigdick whore horni teen fuc,0
ys im tht bitch like cmurder told go forgiv noon die fuck feel aint noon afraid,0
porn fuck quickest soapi cumshot ultim surrend uncircumcis co zzavtsurwa,1
myhouseknox compar english skill quit sassi x89,1
men say bitch slut whore frustrat uncomfort thing ever even friend context,0
today wtf gonna bitch bye fuck yall yts,0
metro keep talkin slut bitch iceberg305,0
naughtyamerica ava addam amp francesca le tonight girlfriend,1
spring break mission trip deposit made lake view camp brought youth given ava,1
sorri everytim start right come spotifi think someon chop screw duval x89 co ena4qu4wlz,0
okay gonna believ bitch rm2iscom freak fuck classi x89 co cgbscphtqq,0
rasisalilbitch blythehartdown girl slut shame act like grundi stuff archi fault funni,0
hi twitter done novel draft hot sec like hot week amp would like fill bit,1
kailyndimalanta vampir x89 know,0
karimshuman know actual guy x89 x89 blind x89 x9d x89 x89 co kmso4kf55,1
rt susanforct famili inaugur ball could campaign without patienc support david ava ley,1
help girl amp dm pleas sellingnud nude booti ass twerk cumtribut cum slut snapchat,1
young girl busti manga hentai enema intern cumshot quadrupl penetr young boob domi x89 co 2b1m6ou3m7,0
rt reiandmigi call famirei interest know rei amp migi love stori final share us hit 250k,0
nigga tight would bitch hungri boot feen chop ch x89 co hpmnavtdpv,1
ava dead ass came home face beat wana know tf go amp,1
clip final fuck upload get readi 4 ava spam asshat,0
bchewelri maelynn denis sassi month would perfect x89 photogen happi wh x89 co ykizqx2r8m,0
adrija bh adrija sassi cute interest found co idsfp4pmjl co ime9k8dc1c,0
piec human ball chop knife co lrruchcn8w,1
sinapus nolifebob valdishoo mkultralitebeam cours monster seeth clean conscienc folk x89,1
cehm27 let slut want,1
carotweet x89 halloween night dress total slut x89 x9d co rcwtldvvmc,1
maryez91 oh shut proven fals funni go straight slut shame girl,0
today n nhaven x89 decid x89 though sassi funni bitch today x89 co vmzkk1kdce,1
rt diamondlark shut stupid slut bitch know like ittt,1
rt campbel akil got ava prayer jas freefredo,1
rt fussybabybitch cum hungri littl slut could eat,1
ava amp tiffi know littl chickade matter whether disappear wilder,0
bitch realli ask x89 x89 tonight x89 x9d answer question,0
rt itsfoodporn extra cheesi mac amp chees,1
rt davideatsviagra pretti fuckin crazi fastest way piss men defend women almost make want becom ac,0
lmoneyyy abriannnnna yea way woulda sat cri woulda fuck shit,1
co 4gmtz5llxw n ncumshot playboy slime game fetish galleri network xvideo x89 co ths3grbqxd,1
sorri articl ball think great give girl opportun see femal perform,0
jdgmntlgay grow build person make funni colleg shout funni bi x89,1
know roxi would talk guy result want date end sai,1
truelaurel sassi danni broken hurt co pgllpvwa7,0
sheratesdog feel also type guy slut shame girl use line,1
danielcookney johnclarke1960 jamesclev call use fool protest co 4ux6caw1v8,1
repost natzmm nyou dirti paint fuckwhattheythink sassi x89 co x2jxu7iwhx,0
cook chicken finger chop salad crouton x8d,1
graciecovz babysit fri x89 trash pile x89 x9d scream cri li x89,1
rt estroberryboy slut hoe freak got differ girl everi day week check slut hoe,1
ginger monument memori sassi bitch life co 20erw772qk,1
pramsey342 ava torn yes set amaz exampl wrinkl time terribl hard know say,0
rjpiff let x89 forget jami chop bitch,1
tsmith290 cw charm x89 shame patti around middl gif,1
rt itsfoodporn chicken amp egg sandwich,0
jon amaz amp enjoy psychot game w ava endgam far r,1
play creek indianapoli danc drunk climb fender baseman x89 co ar9rgcifgf,1
anarcho vampir deertaur train slut comin toot toot,1
oh wondrous mist ava wait pedder bay winter morn gorgeous campus wait,0
ronda rousey wrote shame promo bitch guess co bc0i2gcxxq,1
porn dog celebr bear indian lesbian video slut unwant x89 co sudryunlyv,1
check ad closet poshmark ava amp viv 4x sweater knit pink pullov v neck top,1
rt kimjonginsid girl respond 80 snapchat 4 hour legal oblig call fat slut,1
mess zuckerberg sf general largest public hospit sf amp top tier trauma center bu,0
discard victim girl color label fast amp precoci survivingrkelli,0
rees witherspoon vogu daughter ava 19 amp mother betti see 3 generat,0
kingbtc trade short bottom margin n nyou,0
great bought 8 kyliecosmet lipstick probabl go come w fire ass shad,0
3 11 outsid scream hellskitchen,1
rt jus girlz rt u want suck ur dick horni boob tit ass pussi slut cumslut blowjob nsfw porn amateurporn dick,1
sarahbrothert0n apolog assum slut hurt know,0
steami mac x89 contact x89 make realli watch theori x89 looki x89,1
gross porno espa ol swiss brazzer video pussi livejasmin nackedporn video pornt x89 co bdkroueccj,1
rt repbrendanboyl king sudden becom white nationalist alway one amp gop damn thing,0
rt blue vin92 abuja guy got situat hand meet maro oghenemarho notori thief robber kito amp slut visit kitod,1
might say look like desper pathet attent seeker slut tri scare drop dead gorgeous bitch,1
rt jae juic shine pentagon that mf anthem slut drop bitch like nobodi busi smh,1
selena gomez talk movement black peopl like comment shame women instagram work wi x89 co afewikfwtc,1
rt santiagoshaught babe bitch need coconut cock arm ass,0
preval sexual assault violenc south africa dub x89 capit world x89 x9d x89 co 7rv3dzb6vn,1
anim fandom check cute girl skimpi cloth love much also anim fandom look,1
jayleneangelina halloween dress total girl anyth ab x89,1
sheeeeeit glad sold n bought ltc woke morn absolut kill,0
team russian bitch slap nsam remov life,0
rt liltiyahh wanna fuck see hype,0
friend would call stupid slut bitch ass face joke obvi tho,1
depend genr memento psych thriller sassi korean version romcom idiot come x89 co zzkw5r0bvi,1
honessssssst halloween night dress total girl sa x89 co jwckr2icsl,0
richi mon321 avagg total kid btw im creeper ava also fuck guy keep tryin break shit,0
scene parti vanderpumprul kati keep talk shame x89 co bv7bjm6wkq,1
someth nasti fine sassi non actin call daddi ni hit x89 co nxzy2y6ynn,0
muchtruffl ava lawz yeah weird everi racist politician amp parti back campaign th,0
photo grid girl slut free xxx trailer best bodi nude demi lovato cartoon porn girl nake water whiteolderw,0
rt cumbriapsginsp hello one newer recruit tpd red commenc train feb amp replac pd ava reti,1
everyday would everi second precious littl x89 x9d x95 x8f daddysgirl ryle x89 co nkjwspddni,0
goodnight everyon even bitch call slut thx compliment,0
kandysin problem think friend twitter x89 littl sassi,1
yoongi slut one even consid sub alon,0
cray campbel oh absolut awhil,0
rt realtalk2472 ava beat confess prison shot sight found sleep tree murder amp attempt,0
long hiatus back knit still cascade220 estella dress pattern ell amp ros,0
ceaz theday x89 act shane dawson tellin x89 symptoh paul bitch x89 say https x89,0
popcrav billboard gaga amp ava max ariana choke thank u,0
man miss beat yet think believ drop ball come amp ava truli bless,1
horni girl want help edg cumtribut cocktribut hard wankchat cum cumslut whore slut cumwhor,1
like blood nigga couldnt found wrong right motherfuck x89 co j7sfyjllww,1
yeah amp besti much everi classmat mention slut name slight chang topic,1
ladi beyond scare straight said lil girlvhad someth provoc girl liter,0
like jerk watch big boob date hot kikm jailbait gangbang girl follow milf,1
util deal aka merger arbitrageur graveyard ava come skull amp crossbon warn sticker,0
2 king 17 24 king assyria brought men babylon cuthah ava hamath amp sepharvaim amp place citi,0
yeraulddamitti aye get come fae like time video let fo,0
geniussyeda better dildo sext uncl,0
want slut readi anyth select bitch site fuckm,0
bff share everyth obvious dbbwithmybff keep,0
call stupid bitch block x89 fault follow agre x89,1
love fap watch crazi nake bitch hmu dm ass live gangbang dick busti camgirl,1
drink coffe enjoy peac amp quiet gt gt gt gt clean ava take morn nap,0
effitsfranki x89 lotura allura strong claw,1
retweet wanna cum n n hotwif horni slut mistress milf slutwif slutti goodgirl badgirl x89 co zraefv8k4z,0
sarahspain man articl like ruin sport choos footbal money amp fame amp easiest path,0
hairi japanes chick got garden plow rt asian porn video girl milf cam webcam dick gangbang slut,0
matthewgoodgam melaniecripps79 ava kept say wipe eye mummi amp 1st thing said 2 mum melli got babi tummi,1
rt harronwawk evergreen remind five senat run presid warren harri gillibrand klobuchar sander,1
chloe kamsk1 becom chloe slut n nid rather cringi,1
well person start repli spout speech confront report begin stranger x89 co y7ygo6rkhi,1
wallace01 myalaskayacht x89 judg block x89 x89 co ajool4zipx,1
freez ranch today skinni loaner coat prompt right sassi way,0
love love love soft n hard dom normal like good girl good girl,1
women need stop slut shame amp blame women man cheat,1
estellabathori invit raelilblack around infam crucifix dildo listen dissect n n x89 30 minut x89,1
slutofthetrix shadieeyah caught breath stood wipe best could,1
name u call babi babygirl babyboy bunni kitten pup slut,1
babi daddi mom slut swallow bitch ass,0
denofthiev credit roll al amp put video french bulldog puppi ava challeng say awe watch,1
jemelehil sarahspain amplifi player support mrs ford given pl,1
love mann amp love film brain need help 1 major plot point mayb scottderrickson kumail,1
trust fug slut,1
photo grid girl slut free xxx trailer best bodi nude demi lovato cartoon porn girl nake water nake teen,1
get attack amp n x89 swing x89 smack n n bredatea,1
im outchea call bitch slut know bout slut,0
tinydaeguboy averag 12 year old gross im consid normal slut age law 16,0
fuckin slut amp think ya,0
hottest nake world nake butt foreign colleg matur co txoesxuobt,0
ava oldest 4 kid home brother sister train champion ava black belt,1
x89 local girl x89 n n x89 xa0 co bigmjxu6st n ngirl innoc jessica nadia hilton xart x89 co aeefw4kwyn,0
yes plz reboot bap talent amp beauti auroraperrineau ava robert townsend whartonrigbi,1
check ava amp viv women cream black stripe long sleev sweater plus size 3x avaviv via ebay,0
sex colleg muscl cumshot small hentai glass lesbo lesbian feet x89 co pqhhukp1nd,1
lover nake burmes nude buy homemad porn rti teen porn mov es girl make girl nake porn nude pic,1
playlist bts araivanbuuren mooniunatik sfqomhz call teenag stranger bitch sassi x89,1
x danniell cunton bitch never repli letter spiceworld sleev stupid slut,1
rt mckillopcourt slut snapchat peopl serious anyth better time tri,1
ava fuck got excit spirit crash,1
vivaciousvid accord open talk right metoo in x89,1
rt plantiov ever go obsess band artist amp slowli fell love amp invest,0
x8f x89 x95 x8f sassi ritwik back initi episod enter l x89 co zmfcsceno0,0
trump lowest low thank pelosi amp schumer given equal time point lie,1
chop inch basic mean x89 x89 shit,0
dutch pussi manga porno pornn brazzer video fuck x89 co 5zjvlpwxci,0
rt cvstielsdean everyon say thank robert sheehan,1
rt goddess lair bts twt made happi honeybunch purpl moon amp back best year gold,0
thank jewish chees combo chop chees broken barrier shit fuck good,1
littl savvi petit sassi amaz savvi friend learn savvi dog x89 co wedpjdkjpf,0
crush girl turn slut slutsham 2019,1
dogi style renaiss chubbi tubemal brasilian xxxxx lucesita cevallo 3xxxmove,0
suefoster60 oh thank sue think ava amp go hour amp half kill save phone batteri,0
rt repthompson american peopl demand action prevent gun violenc year today join speakerpelosi amp gab,1
check ava amp viv woman plus size 1x black long sleev tunic top blous shirt v neck,0
great moment dougiedougdog amp gal pal ava goodi 4 paw love much worth everi penni,0
rt masikakalysha nigga pillow talk wors bitch nigga dog shit outta old bitch new bitch call everi pa,1
emmma x0x becca jessica kylieorourk nude sent becca singl way got back,1
rt annerabbitt thorough enjoy student presheadford amp teacher jtgalwayjtgalway regard chang junior cert sci,0
hi peyt thank best friend amp biggest pain ass go great thing excit,0
rt emmachamberlain miss fuck sperm egg embryo lump didnt shit,0
terror israel amp militari occupi forc bring death amp trauma palestinian unarm man surround,1
guy fuck x89 blah realiz x89 fuck caus p x89 co 71wrghyrba,1
arrog sassi bitch interview tell worldwid handsom lem x89 co uulcrnkjez,1
andredeirey origin stan x89 stand x89 honeymoon sassi madison montgomeri wannab act x89,1
angri reason henc fuck ding dong son bitch slut fuck,0
everi time tri naga balik tanan memori bulli slut shame amp etc etc,1
cosmicdisastcr sext x89 work girlfriend,0
rt thedaiiypuppi everyon need camp companion,1
x89 report caus x89 x89 oh sassi x89 x89 idk x89 x89 co pn42bct4sj,0
100vagina overdu tv femal tire silenc around girl amp sexual behaviour need amp desir,0
lesbian strap boob redhead black blowjob eboni masturb extrem fist german sex x89 co pd28wxnop5,0
thatgui2 matthew mcgee12 respect amp acknowledg someth child know littl,1
grandpar pretti ngrandad think brett someth nme,0
x89 x89 n n co f6p7qirkdb n namateur creampi drunk jerk longest cumshot x89 co kwrestvw2r,0
sleep slut obvious gay,0
boo daddysgirl redheadsrul happyhalloween2018 comingsoon beveryscar week x89 co r9o8evrlmg,1
slut bitch well big fool prostitut like would alway come pretend,1
well shoo would happen speak venom someon take react send pipebom x89 co v6cpwgtbmp,1
notic everi shame girl school x89 hoe life x89 x9d x89 co ejmrk2fhcz,1
gossip sassi bitch blair waldorf,1
rt marinaintermin1 video porn big tit girl latina hardcor vidio group sex norsk blond tight porn extrem insid bergambar porn vid,1
sven sklave ladi bizarr adminlk femdomdaili latexladi migirlzm royalti promo marketingbdsm well train submiss toy,0
rt kathybitch69 fuck like bitch horni want fun rt regist write note,1
realli chop hotdog ramen x89 fuck x89 x9d vibe,1
richardharris69 sharaann10 ava whileblack innoc turn death anytim day amp day n,0
omg ava max new ladi gaga gaga debut 2008 amp ava debut 2018 shooketh,0
rt tiapogai51 cum side girlfriend pussi gt gt regist free note verifi email send msg gi,1
im feel like someon slut add snapchat daddi bbc dadi ass thick gay snap add snapcod,1
twilightfairi 50000 tree sanctuari get chop tree n x89,0
let get parti start join dj ava air soshi classic amp chill monthlywednesday radioshow,0
love everi morn ava wake aunt amp cousin tell good morn beauti,1
itsgeorgieboy1 sweet psyco ava max mariah normani amp sam smith danc stranger,0
white piec label hooker prostitut walk race,0
