text,lable
romasuxx cobain ava man tell paco good redeem charact fuck show,1
rt same chase girl think cute act like slut look trashi sweeti,0
eh realli problemat movi even tho curious conflict live zamunda amp,0
janic e mbggrg jdemoor benwikl tinamorphi idiot sext weiner noth x89 co esppdce2v9,1
hertweetx x89 enough x89 x89,0
random michaelbubl n spicegirl scaryspic hair twinsyn x89 co dgy5putca3,0
amber rose black china big hoe move slut walk etc stay singl fella u got girl wife lik,0
cours life bitch slut would easi,1
better girl slut jungkook deserv better think better,1
fkaava ava alex amp highest standard admir bc match energi,1
hey boy presidenti suit today amp tomorrow wait come devour today til 7pm,1
rt nokiapowerus new nokia smartphon nokia 6 2 display hole leak 3d render amp 360 deg video,1
officialbigev white peopl co 2zdq4j8j6k,0
rt faxrynsfw good girl take punish yes everi spank count understand wanna get troubl,0
sluttpuppy910 puppi would aw would nev x89 co f9mpgpull,1
horni daddi slut snap nou696 n horni sext bbcslut bbcwhore whitecock white fuckm x89 co tljxog0xst,1
chicagobear piec knowital coach decid young inexperienc team entir week x89 co nla7meza7t,0
kingteddiebear idiot broke littl amp slut swear make heaven,0
briannawu go eaten dollar menu amp know unpleas eat cold,0
casdeani casgirlsam see tweet go hearsay context matter tri,0
donlemon maddow realli free campaign advertis lie given trump abcnew nbcnew yo,1
gym amp headphon amp accident yell littl slut everyon,0
stop shame want thotti x89 busi world,0
soo ling everi sassi yut lung x89 murder co wsbqfv62iw,1
alexx mason96 tell prioriti treat prioriti complet differ thing,1
ethanvansciv renfam alway group guy gamerg,0
like chop liver roll chuckl n ni x89 littl anymor x89 co kil4lcpbm7,1
amp night sassi sweet co xwffhhdg0k,1
dm trade pic girl say weird ass shit dm accept whore underag,1
slut unsaf sex hot spanish teen telugu masala sex sexi girl christma nude date nude teen xxx english fu,0
jinujiho jiho whenev sleep call slut whenev gay doubl standard much,0
15 19 hijack saudi arabia chop go,1
anamoraless chop liver sheesh leav x89 co zunyiyr2jx,0
thought sassi sin birth x89 cudd co vqvmqmpbwh,0
happi 1st birthday twinsi ava grace amp maya hope wish happi bring broug,0
x89 bitch co wrd5dywwhi,0
lovelyatlantan realli like sleep first date n nif sleep x89,0
rt elmersgeorgia omg bitch fuck amaz ass free signup cumtribut cumslut amateu,0
rough brunett white nake video spank lesbian scissor bigtit massiv c x89 co asuhbvfmsh,0
im bitch im slut ever think would work,0
need fat cock sit ride cum ddlg whore slut cumslut horni jailbait cum pussi ass,0
check ad closet poshmark ava amp viv 4x new skirt pleat dark blue amp floral,0
officialpep break fuck cap somebodi whop stick mom x89 co iiqcgxcqff,1
better readi stupid tweet flip sassi bitch,0
neo 2019 let serv shine exampl adopt wait make first move ava,1
mkultralitebeam nolifebob alreadi thread favour gamerg repli x89 co 9hnxzmfjes,0
daddi horni want xa0 x89 co 4lg0qtq4o9,0
lt 13 gt expos collarbon snsnj,1
delet shit bye bye way let one last harm ava dank offici whore fuck bitch fuck,0
rt incorrectdalla yeji rais voic slight speak ryujin end groceri aisl want chi,1
lifestyl suck slut aw,0
favorit stori child probabl first x89 x89 x9d n nsassi littl bitch birth x89 x95 x8f,0
stretch someon like dreamhampton ava make documentari base fals accus mike,0
friend girl get relattionship 3 guy year sleep c,1
skinni bitch fat slut choos adventur tour,0
rt 7lakesvbnew huge congrat morgan janda earn 6a setter year amp ava underwood earn 6a newcom year th,1
guy im wet pm dropbox 10 paypal kinkygirl slut slutti fuckm yesdaddi daddi sugardaddi,0
rt hinaaddict smile face give us peac amp strength proud part magic journey hina khan rock,0
rt mackenziex1431 retweet give hard cock behind horni tit daddysgirl sugarbabi sugardaddi nude dmme cum,1
rt jaimesbricnn sansa feminin conform societi standard surviv everyon weak fuck bitch cersei femin,1
use think gaga stan part unproblemat stan fuck wrong motherf,0
miriamyablon sirmervcharl ava zinnedproject realli think histori strong suit wwii amp,1
look everyth power x89 x89 go x89 co iuxziums6i,0
guy post girl get 30k follow dress like slut sound like,1
talk bitch trust bread x89 right knif x89 co awnhrsohcu,1
nake slut vid blow porn tube carolina pussi homamd pic forum hot girl shower hd anorexia xxx anal teacher fu,1
umcornel bitch offens money would solv liter everi singl problem singl pro x89,0
lil tortellini everi retweet x89 maggi x89 co qzoqa4aip8,1
whynothannah happi birthday friend anyth never forget co wlggprvlst,1
sweet pee toilet gt regist free note verifi email send,0
drpetehd fruzs realli gamerg polit youth x89 co zygwszjhxk,1
n yorum tabatha suck cock video hd mobil sexi uniform amateur busti blond bitch suck cum wild xxx par,1
good girl bring bitch x89 x9d x95 x8f,0
charm odditi happen liar dumb slut bitch c amp fuck life need x89 co fgiu60dlgg,0
breath innnnnnnnnn amp focus sole rise fall breath,1
jasonfitz amp sarahspain easier 2 root 4 team post season chanc team h,0
monkey see monkey money see money go money see bitch slut right man,0
rt voicesin action someon slut shame say girl ask finish,0
rt garyfromteenmom where fuckin son,0
honest stand ava karev stage grey canyafuckingnot,0
rt aunti social rub talisman asa imag thumb amp forefing slid place pray ava sh,0
look nude trade kik dirtybabe4 horni dom xvideo paypig panti whore groupsex creampi,1
grandpa x89 bitch doughnut x89 x9d look x89 never chang way,0
rt lonestfeei never fuck like everyth went alway hope could communic,1
talk make see incred strong amaz tell fb,0
nail sassi hell tip look mad bitch x89 x89 co zdd1zeprl7,0
teen cumshot compil anim ride omegl boob perf x89 co jvp91qpqj5,0
mea af nah seem like sweet respons young girl put someon abstin equal slut shame,0
speaker pelosi amp sen schumer deliv joint democrat respons trump address thank speakerpelosi,1
take slut daughter amp littl terrorist bastard go,1
rt ashtrash fuck liter four femal poster like forgot hope manti nebula ava exist,0
honeyse0k x89 comic relief x89 treat crop complain abou x89 co rp0niuemjk,1
katevstheworld kotaku exact gear ad playabl women multiplay thi x89 co adz2do9x8i,1
hyl ian rardk64 like chop sword tiddi everywher 10 10,0
yongscult tri sassi frenemi kinda shitti idk x89 co 0k6nz0of2n,0
luke5so x89 nastiest skank bitch trust fug slut co 2bxxodwoi3,0
rt generalnuk bitch slut slut shit excit,1
oh yes isi slut british citizenship revok duel citizenship british amp banglad,0
rt isabelzawtun daughter love thing learn grade 2 amp woke morn whisper bone,1
sarahspain everyon knowledg most unbias engag twitter great exampl,1
feel sorri shamina 15 vulner high doubt knew extent,0
x89 crazi hook guy x89 consid hook x89 co auz8zuztdc,1
rt dickiev hey let forget salut frankmartin sc amp gamecockmbb amp surpris w 14 nation mississipli st,1
rt witchychao astrolog post alway see ari bitch taurus lazi gemini two face cancer crybabi leo beauti thing,1
tiktok like shame refer shit,0
lazi chang profilep lemm celebr kaisoo day ava amp kai bday project lol,0
hot milf slut ava devin face fuck sybian,0
add snap alyciapow someth naughti amp get free nude premium 45 lifetim 85,0
rt loser29908215 hey jailbait girl se london look hookup anyon interest cumslut whore paypig sugardaddywa,0
shawn cotton slow x89 chop amp screw south fast,1
lawmak say boycott anyth usa american amp busi must pledg allegi 2 israel strip fr,1
rt abc kerri washington john legend mira sorvino ava duvernay among celebr join time new campaign muter,1
call name bitch white trash x89 x89 nthey call x89 co 9rxwr8pzkx,1
rt taylorburrow best relationship advic young women need appli prude singl amp rage slut li,1
armchairexppod mpadman get floor plan amp price toluca hill websit,0
rt goeshira1987 let date amp enjoy fuck nake girl wait right sex date contact h,1
sassi sierra98 talk bitch,1
briannawu oh hell yeah grew poor food nation championship got invit r,1
know girl name ava damp,1
rt nikitadragun reveng nah gonna sit let karma fuck,0
idontkillvibez lmao record doubl standard address women,1
antartist89 convinc loui instagram probabl shi h x89 co hlcwhppaiu,1
oh god made wardrob spreadsheet 44 main piec bad number need buy,1
young cumshot associ fuck camera n co cne5tzg1lu young mo x89 co epzgbudwvu,1
let rememb trump america racist topic x89 co x6lwjqpxog,1
tryna plan ah parti ava amp ion even know babi gonna,0
got amp cook ava pancak egg amp bacon,0
darius m4 women constant tryna guy make hoop x89 co ta3hqh9tzd,1
tribe6 onip appl x89 chop tryna yellow album amp quee mood,1
exoverdosedd listen get undeserv genuin hard g x89,0
hannahcalloway4 lmfao guy block whoever blatant ignor dm amp told gay amp,0
adamscheft sarahspain talk nice soft land tampa time retir,0
rt younginyef marvi jnr hell yeah amp natur slut bucket,1
rt post comment sexiest nude favorit pic get domin free sissi bitch,0
slut shame nikki hater evil yesterday promo women histori imo,1
colorfulwdw dearneel x89 sassi co 1fqbjfiov2,1
min sassi btsplayroom receipt readi proud,1
hate peopl would dress impress ex like bitch come crawl back fuck slu,1
matur boob japanes franc larg ellen saint neighbour deepthroat cumshot tu x89 co exbwhto4ai,0
x89 x8f watch x89 x8f n nt co ttrrmme5t2 n ndoggi style asian asian asian video blowjob video nsfw,1
rt alli sheehan ginni weasley prefect except skill magic particular defens spell,1
mushi stuff readi mushi fuckin slut,0
cheryl blossom bitch co b7qowwx5dj,0
daishatherul 3 amp enough time caus ava goe dad amp alway get,0
x89 x89 dirti fuck whore co 1vk3m3ds2c,0
highschool twitter x89 omg cocain x89 gross still slut x89 x9d x89 co 8pvh5yn7l1,0
rt artworkjin viral video armi twt alway yoongi relat first yoongi seesaw fancam second three girl slut,1
avitaperon ava ikkkk shock sad amp dishearten guess clean wick long last minti fre,0
girl post pic underwear n boy b like treat u human u f,0
longlivelilman nigga gay convinc citi girl brung slut outta femal amp brung gay outta nigga smh,1
meme slut sofi ya tax payer money food stamp hard work fat n need eat,1
differ make face uncertainti death fought hardest vi x89 co umchlourlb,1
add snapcht rosewix butt slut great milf bdsm got pussi creampi video red milf steel xxx milf tube anim,0
rt treasurevongol girl 28 boyfriend slut ygtb stan,1
rt xenoughsaidx fuck hate wast time,1
lmfao amp angri atst call maryam slut givin birth nabi isa without father shame,0
send someth co dkrfd9nfja,0
ava devin u bitch ass slut u fuckin owe 1 000,0
porn bushi carmel moor daniella jaclyn marcus unexpect cumshot whitney steven young old x89 co 6jap9wxhn,1
rt foispildon30 webcam sex chat chat real girl exchang nude horni milf follow link lot fun w,1
slut garden mental health tonight least look co ochepldteo,0
well around sassi nigga atlanta x89 blood co dlqgvevqya,0
x89 shadow realm anoth sassi music bitch nonon jakuazr co agdvyi2wm,1
happi birthday favorit blushingbrina lt 3 serious x89 word amp x89 co qvzwqmshdx,1
spent soooo shame talk girl twerk onlin x89 co d73abaqjs,0
motherfuck realli get hand chop co ztrwv4jq6m,1
happi birthday sassi littl block twitter right x8f x89 x8d x89 x95 x8f x89 x9d x95 x8f,0
brendabrendami sure secret messag told well famous model sin,0
brattietingz alway fat bitch bust slut leav sister alon big back ass,0
sassi look whole attract babi,0
thotwin sweet psycho ava max play min hot 107 9 listen amp vote,1
feminist hero well unfollow twitch streamer call ex girlfriend huge slut math,1
bbbeccaa sassi suit x89 look puffi mean sl x89,0
rt nidhilovesgod hinahol eyehinakhan inspir girl live life amp want name well fame,1
justsaytaep happi birthday bro gotta link soon amp enjoy luv slut,1
slut puppi come work std test 18 year old girl 2000 babi horni af,1
essilfiee amisdiari oh realli know nigga slut shame assert girl wow understand use signal,0
shoutout sassi littl allll blast worldcup brazil co ur5kim06mi,1
rt janed giveaway care handcraft creation week nena amp co give away guatemalan handcraft convert day bag,0
byajperez sarahspain adida cool concept b amp w one look slick,1
hot slut sissyslut sissytrain femin sissyf slavegirl femaledomin bdsmcommun,0
heybratti test somebodi tryna lmfao,1
rt bitchfacejen call dork slut lol fool pick wrong person gona laugh piti,0
sister know sloot mean sloot schlamp realiz mean slut translat,1
trialandtri pretti someon like mustach gettin chop caus lookin grimi r x89,1
rt mbempow finer point often ignor cishetero black men hunt tortur murder male amp sexual,1
rt taehyonc jks finger h jk whatth fuck,0
retweet amp like draw pic ava,0
rt tatebutsu1983 free sex date citi come girl wait sex date contact,1
lexilor manyvid good girl,0
rt g0n3grl girl post pic underwear n boy b like treat u human u fuck slut,1
big titti slut tigerr benson enjoy deep anal amp dp fuck session tigerr benson anal doublepenetr bigboob,0
first seem though right choic bc chang mind later amp flung open door mo,1
tweetydim x89 believ x89 game today feel star break n nit x89 x89,0
rt dtp drip jack fuck shorti watch struggl make nut,1
rt kp2feder much hoe slut dog ass bitch etc tf nigga insist bother hit refus,1
kimbxrlxyw sleep angl starfish sleep across whole bed space sassi snap x81 x89 x8d x89 x95 x8f,1
deepthroat cumshot jerki girl video black lesbian french amateur coupl horni surpris x89 co 2wpbozsesn,1
malc0427 manicur make sassi video put polish co h6evmx0fmm,1
rt veggiefact that bitch im fuck come,0
rt avamaxaccess accord sourc ava max may record collabor zara larsson amp rita ora titl goe,0
nuugzzz oooooh yeah definit attest though mouthi back x89 co wncvy6egji,0
cameronebig peopl still honest want chang chop,0
u amp ava big cute thank,1
mirroredwarrior vuhnilluh know get kill mage slut humili,1
2019 spell bee champion ava johnson brahamproud,1
check ad closet poshmark ava amp viv button long sleev tunic shirt,0
holi fuck shit judijaikrazi follow back know know time favorit bad girl,0
possibl end still book n nhere thought dark x89 co e8g6rsxln4,1
pretti much like fuck right,0
swear sassi bitch tri everyon listen rm x89 mixtap al x89 co ncxyugfglr,1
rt ivantoogood sweet tea fuck bomb,1
retweet amp follow wanna see full video contact,0
sarahspain 8 10 friend come amp go dallascowboy fan dalla appear,1
jade croghan peopl fuck funni,1
rt omjis0e8xgxrucj forget,0
boy understand like other treat like slut like bitch th,1
bitch tri talk ignor feel like slide say slut bitch,0
know know babi act right everyon like fine amp still like,1
desirebeiow call madonna whore call madonna slut ungrat stank ass bitch,1
jugg hotti jizz n co zrktekqavi sexagenaria cumshot compil zenkova x89 co l51x40rfid,1
phone autocorrect slut scoobysnack,0
malachitetig understand point nthis first gog caught lik x89 co 8idkfpfqcd,0
sarahspain first saw episod trackdown post 2016 campaign amaz,0
kavosyt piec that anyon shame alissa violet think f x89,0
sex video teacher video pussi video porno partouz hardcor video bl x89 co kjq1lxgycn,0
nice cumshot nake chick electro creampi lesbian lick hooker german teen x89 co ogsmqxn9pk,1
porn realsex stripteas femdom cumshot caught masturb homemad video uk x89 co ggwrcpriwn,0
5u6u56ouiwo photo sex porideo video porno xxx tabatha cash xxx video vie mom sex porno izl video xxx fucki,1
dirti whore bitch co hiplwmrvon,0
miss summer tan nude cumwhor venmo sugardaddi sugarbabi horni ass youngteen schoolgirl,0
rt sarah rose mcm slut shame fuck half girl know,1
regret egirl irl friend call internet slut thing internet,0
babi girl princess honey sweetheart slut cuti kitten,1
pumpkin x89 pumpkin pumpkin spice tri x89 hate x89 co yzaimvnhov,0
rt 6lack fuck u yo blog r kelli,0
watch chop junior amp watch ratatouill decid want x89 co qrllayokvi,1
hot nake girl juana tyler beauti show learn lot much,0
oper nasti sex slut brooklyn99,0
atomiclust x89 stand x89 posit vibe x89 x9d motherfuck x89 real,1
anyon look fabul tv amp film intern volunt perfect candid ava tylerperri,0
watch proceed three point x89 co j3d7gsyhsv,1
cum slut charm amp bracelet cute bdsm cumslut charm bracelet 12mm round order full confid,0
omg may like ava fuck sniff fuck creep chicagom,1
sportsmockeri offens need score amp kick extra point go two everyth,0
also mean biburi regardless everyon girlhood futur adulthood real green tea bitch,1
think dumb boy treat girl like suit need enough like girl go,0
american asian side twitter full girl complement support hype austr,0
watch michellevisag sundaybrunch person clash sassi bitch meet bitch wa x89 co gihxpuwdf3,1
step give nephew labor nt co l2f8288xkb ngirl victoria nichol x89 co uy3duluc1,1
theuriau pictur femal werewolf transform nake fuck movi nake co enbsfmurs6,1
follow killuh smokez47 ig killuhsmokez47 420 4 killuhsmokez47 killasmoez 4 8 7 dolosmokez33 bluevv soundclou,0
ae ava realli dumb bitch,0
ava grace show fuck dragon realdonaldtrump,1
rt flavorjeon rt join broke bitch gc activ break ur spine dont let die 15 pls problemat idrc activ,0
cum dom slave feet girl tribut caah slut hey join insta snapchat onlyfan instagram mkb941,1
rt overlordexo rememb stream melon amp korean music platform amp download song love shot amp dmumt great help,1
one bitch begin paint class alreadi realli good paint know die slut,1
boyfriend accident grab x89 sorri slut cheater,0
want chang ava jaemin alon fuckin gorgeous renmin precious,0
namseokislyf bitch cri x89 sens sassi today sens,1
believ littl fadster alway complain madg stan call gaga reduct bitch,1
cheat cousin excus want prove marri x89 co p9edakm9xl,1
world halloween dress candi world halloween time x89 co nbdzjiiasa,1
rt rachel alfr everi girl dread shower know one everyth shave purpl shampoo deep,0
mom fuck fuck click watch anal bbc big ass hd vid,1
rt victoria faithh im stress anybodi year year self love self care amp best,1
rt curledbitch boy dm like hey hey hey hey hey hey hey hey hey wow fuck slut hey,1
sarahspain know open tryout breweri snow 6 day kicker amp inept,0
stephenahart geminimoon tjarmonwrit ava craigthebarb chanel hampton timtebow jaredeasley joshuaduboi,1
rt wendi willlam hottop cash outsid bitch releas new song titl babyfacesavag bop tran racial dan,1
good riddanc bitch one like slut shame cri attent drama start ass anyway,0
terridelcampo book roger ava eveew kenidrarwood blackenterpris fredtjoseph ze cool coconut ugh stupid,0
excit see work publish ellipsi thank camill dungi select subm,1
great bought 8 kyliecosmet lipstick probabl go come w fire ass shad,0
rt joshscampbel michael cohen hear unlik anyth seen recent memori wit essenti unencumb,0
badxtear bitch hooker streetwalk ndnndjdkdkddk term whore know,1
davidplaysick conscious girl funni caus anoth x89 x89 suppos x89,0
mikerwatt ava death penalti usual seem use govern amp state fussi ab,0
rt determinadiy one time ex realli mad broke thing amp sent amp never talk,1
gkeil go chop kati lahren sport opinion,1
dianewynncd retweet post special set think x89,0
great start 2019 3 amp 4s 3s 3 1 vs wildcat 2s scorer shona stella sk 4s 3 2 vs ghk iv scorer ava phoeb beth,0
rt thecloutbitch sex good give,1
ava illig22 thing ppl need know thing idiot tweet exampl,0
aussi sext fuck pass friend fuckk movi freedownload mihiro co c4rukci4bc,1
x89 touch bitch sassi,1
horribl terrorist love bitch begum famili say may legal challeng decis remov citi,0
walk past someon protest campus say lot hoe arizona slut univers,0
rather chop sword twist co 6vkszezmsc,1
ffm adult tube caught masturb nasti asian massag ultim deepthroat cumshot compil x89 co 9cucrilena,0
busti mix fuck abella anderson offic movi porno belanda silvina lun x89 co l3wm9lrw14,0
pleas vote sweet adilynn 1 vote anal bj blowjob camgirl feet fuck live milf panti,0
x finiti x good slut stun girl,1
alt ram n co 51vhvzdkyn melli hardcor middl school blowjob spi x89 co zqhrtg2jmc,0
get cheater tristan strike fine get snake slut whore kill,1
liter slept hour realli co tfpq7yws8p,0
incest taboo teen slut porn alex coal slut stepsist 09 13 next part amp full,0
last night rough ava kept wake everi 2 hour eat amp chang also never let put dow,1
hey slut cortez go make new boyfriend commit call suicid like last one kill pig,1
zappylocomot wrote dialogu wolverin match x89 sassi say,1
album colour world spice life everi everi spice life peopl world spice yo x89,1
rt datboimarvgo thousand stori like back day probabl fuck live like noth,0
small slut japanes unwant creampi quicki interraci tango porno quiver orgasm mas x89 co zqgw7hgvug,1
daddi x89 x8f n n n n n love grate daddysgirl bless fortun daughter father loveofmylif york x89 co qjlwyq386r,1
rt girldasahmir word slut funni white girl like amber ssssllutt,1
incest taboo teen slut porn alex coal slut stepsist 10 13 next part amp full,1
wonder exampl ceremoni regalia bill reid galleri kyla women dewc,0
never pick phone call even tho know home happi birthday vipmeetsworld would se,0
older women want bayamon want websex cincinnati video singl da x89 co xqq1b06p41,1
u bitch slut bitch keep messag thing maki,0
queenbeema peopl realli angri social media creat cultur anger,1
upon time boy girl love slut came ruin everyth end,0
rt youngbabycoco hate peopl like omg arent cold omg arent hot like bitch might mind f,0
rt baldyfromdaarea bitch better stop slut shame get boy leak nude,1
teen lesbian upskirt video indian drunk comic young eboni eboni lesbian uncensor ara x89 co ardvq6rrsw,1
daehwisclub jaysdimpl min sassi jjeongucci fckmknj start salti co ifdln3lvbm,1
rt eyeeatbook male privileg abl public cheat nigga either blame girl dumb enough date floo,1
love girl current slut shame peopl hoe cultur tl,1
rt tedlieu manafort may want fire lawyer also um collus attempt collus campaign manag,0
tamarajuana x89 polit move co tuj20qlkg,1
96 word love rachel roy amp ava dash,1
make girl feel like princess deserv make feel like slut,0
dude girl heckin slut,1
cosplay porno cumshot extrem orgasm lesbian play young pussi ind x89 co prfqmwcirh,0
rt friarycolleg shona project self esteem amp wellb workshop 1st year student pictur student se n donni fionn tammi,1
nigga bitch bitch nigga slut,0
major shout offici tink rocker chop theroyaltmedia cocolososay co lxtvwzrllf,1
rt ppvinest hoe never get cold anem girl alway cold therefor anem women allow slut shame,1
week offici irish singl chart see seven song reach new peak incl markronson amp mileycyrus noth,1
ok guy girl iknow awesom lot answer 50 question far let get 1,1
sell bundl 10buck whole dropbox link paypal pm info kinkygirl slut,0
rt lilraybb ever accident fuck somebodi 3 year,0
angelica koena mitra scene slut wife comic movi fuck nack girl have co fpcxqccxh8,0
rt cravegomezck selena bad bitch selena one need get tuid home girl come serv aesthet thi,0
gordon disrespect hell x89 sorri would x89 real world x89 x9d kudo f x89 co chegkaqm2g,1
det conan kudo waltmossberg briannawu camp one educ public e,0
still bitch realli eric x89 slut co fpl6xibm7i,0
sassi black friend bee negat sleep night today,1
video woman fuck dick anal intercours bleed girl fuck granni porn milf free anal mpeg girl sprea,1
fruit patooti minecraftcatcontest lilli pass right summer sad much x89,1
longest cumshot littl pussi doggystyl compil norway teenag asian lesbian japanes v x89 co 4aabjkhdsh,1
ava historyhero wts use pardon dead person nw fuck murder long live black,1
yall know dont fuck w kid ava honest sweetest love much crazi,1
first put ye x89 bi x89 co dnr7mtoke,1
rt xsweetreginax sold clip poison queen amp amp littl slut abus latex get iwantclip htt,0
u look young american era bowi vid luther vandross ava cherri etc beauti amp fabul u wonder music got low,1
1qsowavi chop blood today 1luvdon nigga say,0
rt chaoticthey see fuckin pebbl fuckin cute ass pebbl fuckin bitch fuckin fuck slut rock slu,0
sex date citi nake girl wait right adult date conta,0
john leger sooo quirki like omg 1 1 free stuff know broke girl like slut,1
rt katrin foxi fuck wife fuck ass xxx forc sex video xnxx com anulingus xxx p xxx porn anulingus xxx porno video hd mob,1
celebr nude unwant cumshot facial cumshot lesbian bikini lesbian girl virgin wet x89 co tkjisqcmq7,1
sassi soda nosleepforyash white oppress bath x89 co gvgxggv1ox,0
wow sassi determin ceo n nwhat name n osimilinwanyi teamobiageliakunwakegochukwuma x89 co oaijwh1v6,1
rt reinajorrin men b call women abort babi killer exploit innoc women slut shame,0
queenzymendezx donnyforev fuck girl bitch brave enough magpapakilala hindi maga x89,1
amp ellieramroth newport creameri park lot,1
x89 bitch think x89 ugli sweeti co 5u3gmyatyf,0
like rt wet girl cuckold dm hornyteen pussi slut spank wet,1
legal teenag take larg porn n co clbnqfqn8u afghani video parti hardcor mo x89 co gifbzwaokj,0
rt irrelevantabel okay whos text amp ava say got sum stds,0
strnglrk stupid giant skank bitch,1
adult sometim young children believ worm w x89 co 9ltxqrrbjm,0
im slut morph amp cml,0
slut alway slut deserv blind bitch karma,0
anoth sext n ni sorri,1
ur team fuck suck blood noth continu watch travesti,1
end israel occup terror palestin amp palestinian ap latim thr speakerpelosi,0
porn anim ashlynn brook exploit babysitt lapdanc longest cumshot roulett x89 co mc6u0jzp5z,0
dm cock rate must follow get rate cockrat cumslut cocktramp slut paypig cumtribut,1
whatev fuck unchain mean realli think player gonna reach unchain state attain,0
ygsfeel thing yoongi n n x89 fuck right kitten x89 x9d n n x89 mhm suc x89,1
patronusmalec enjoy drama usual scroll x89 other love x89 co 72pw2gqdlx,1
